StartDate,EndDate,Status,Progress,Duration (in seconds),Finished,RecordedDate,ResponseId,DistributionChannel,Q1,Q108_1,Q108_2,Q108_3,Q108_4,Q108_5,Q108_6,Q108_7,Q108_8,Q108_9,Q108_10,Q108_11,Q108_12,Q100,Q15,Q14,Q16,Q119,Q118,Q122,Q121,Q97,Q101_1_1,Q101_2_1,Q101_3_1,Q101_4_1,Q101_5_1,Q101_6_1,Q101_7_1,Q101_8_1,Q101_9_1,Q101_10_1,Q101_11_1,Q101_12_1,Q13,Q13_9_TEXT,Q19,Q20,Q81,Q82,Q102,Q103,Q106,AcceptReject,SciRelMor,CommonRare,Claim,ClaimSet,Whether,TargetRating,Believe,True,Wrong,Explanation,ExplanationType,NormalAbnormal
2014-03-16 10:58:33,2014-03-16 11:08:03,0,,570,1,2014-03-16 11:08:03,R_a5zTNXtQNEdkVoh,,2,7,7,7,7,4,7,1,2,7,7,2,2,,,,,4,3,5,4,5,90,80,60,80,90,80,80,60,80,90,20,20,9,dax,"4,5",1,2,52,got somewhat confused about agree to something being true or false ...,seems better written than many,2,2,3,1,Killing an innocent person is morally wrong.,11,killing an innocent person is wrong,7,reject,false,true,"People are more likely to reject this claim if they suffered from an attachment disorder as a child – that is, if their parental attachment was abnormal.",Developmental,Abnormal
2014-03-16 11:00:01,2014-03-16 11:08:15,0,,494,1,2014-03-16 11:08:16,R_9Qy7MjIJKdcwA29,,2,6,6,6,3,4,5,1,1,7,7,1,1,6,4,4,4,,,,,5,90,90,75,70,85,75,30,70,95,95,15,10,9,dax,"4,5",1,2,42,no,"How religious beliefs affect your opinion on the subjects asked about...global warming, evolution, vegetarianism/veganism.",3,2,1,2,Humans evolved via natural selection and share common ancestry with many other species.,8,humans evolved via natural selection,6,reject,false,true,"People are more likely to reject this claim if they have ""Type M neural activity"" in the ventral striatum cortex in their brain, which is the type of activity normally observed there.",Neuro,Normal
2014-03-16 11:06:29,2014-03-16 11:15:09,0,,520,1,2014-03-16 11:15:10,R_eKGH77HZPlljJOd,,2,7,7,7,7,1,1,1,1,7,7,4,2,,,,,1,4,7,4,1,90,60,75,70,90,90,25,80,100,100,10,10,9,dax,"4,5",1,2,62,no,no idea,3,1,2,2,Every person has a soulmate or life partner who has been preselected for him or her by God or some other spiritual force in the universe.,4,every person has a soulmate,1,believe,true,false,"People are more likely to believe this claim if they have a mutated acfga2 gene – in other words, if their acfga2 gene is abnormal.",Genetic,Abnormal
2014-03-16 11:18:37,2014-03-16 11:24:22,0,,345,1,2014-03-16 11:24:22,R_b43fr7wHdC2jM7X,,2,6,6,5,4,5,4,4,4,6,6,3,2,,,,,4,4,5,5,2,80,40,50,30,85,70,40,60,95,90,10,10,9,dax,"4,5",1,1,23,no,,3,2,2,1,There is a God.,9,there is a God,5,reject,false,true,People are more likely to reject this claim if they frequently have “mini-seizures” in the ventral striatum cortex in the brain: this involves an abnormal pattern of activity.,Neuro,Abnormal
2014-03-16 11:21:06,2014-03-16 11:28:29,0,,443,1,2014-03-16 11:28:29,R_bwkctD967edlNu5,,2,7,7,7,6,7,5,1,2,7,6,1,1,5,5,6,5,,,,,2,95,95,50,50,80,60,50,40,100,90,10,5,9,dax,"4,5",1,1,22,,Determining what I believe in and what I don't believe in and comparing it to the rest of society.,3,1,1,2,Humans evolved via natural selection and share common ancestry with many other species.,2,humans evolved via natural selection,7,believe,true,false,"People are more likely to believe this claim if they engage in “Type M lexical processing” when reasoning, which is the type of processing normally engaged in these cases.",Psychological,Normal
2014-03-16 11:42:07,2014-03-16 11:50:03,0,,476,1,2014-03-16 11:50:04,R_6M4UfUGk54iIv0V,,2,6,6,1,6,7,7,3,7,7,7,3,1,5,4,5,6,,,,,2,60,80,50,60,75,70,50,75,95,95,40,30,9,dax,"4,5",1,2,48,no,Beliefs,3,2,2,2,Every person has a soulmate or life partner who has been preselected for him or her by God or some other spiritual force in the universe.,10,every person has a soulmate,3,reject,false,true,"People are more likely to reject this claim if they suffered from an attachment disorder as a child – that is, if their parental attachment was abnormal.",Developmental,Abnormal
2014-03-16 11:50:10,2014-03-16 11:57:52,0,,462,1,2014-03-16 11:57:52,R_dohQvD6FnArmb5j,,2,5,6,7,6,4,4,4,3,7,7,3,3,,,,,3,4,3,3,5,65,60,40,50,40,35,15,15,85,80,20,10,9,dax,5,1,2,18,"It was kind of weird that in the ""FACT"" (even though it was hypothetical) there wasn't any real explanation of what the cognitive lexicon whatever thing was, like I figured it out using context clues but it would have been really helpful to have something.. Also I'm not sure why that phrase was in quotations if it wasn't quoting anything",Belief systems in Americans and how they may be predisposed to certain beliefs,3,2,3,2,Killing animals for human consumption is morally wrong.,12,killing animals for human consumption is wrong,3,reject,false,true,"People are more likely to reject this claim if they exhibit “cognitive biases in lexical processing” when reasoning, which is a type of processing that’s abnormal in these cases.",Psychological,Abnormal
2014-03-16 11:53:32,2014-03-16 12:01:57,0,,505,1,2014-03-16 12:01:57,R_dbQnDwuzPqMD5Xf,,2,7,7,7,6,5,6,6,6,7,7,5,1,,,,,4,4,4,3,2,95,95,70,50,85,60,50,50,95,95,20,10,9,dax,"4,5",1,2,28,no,"beliefs ",3,1,1,1,Some diseases are caused by microorganisms called ‘germs’ that can infect a host organism.,1,some diseases are caused by germs,7,believe,true,false,"People are more likely to believe this claim if they do not have a mutated acfga2 gene – in other words, if their acfga2 gene is normal.",Genetic,Normal
2014-03-16 12:01:22,2014-03-16 12:10:52,0,,570,1,2014-03-16 12:10:53,R_exOXCkBEijGP6sJ,,2,6,4,6,5,7,5,6,7,6,7,7,4,5,5,6,6,,,,,6,5,5,5,5,40,5,5,5,5,10,5,5,9,dax,"4,5",4,2,65,no,to see how easy a person's  mind can be changed,2,1,2,2,Every person has a soulmate or life partner who has been preselected for him or her by God or some other spiritual force in the universe.,4,every person has a soulmate,6,believe,true,false,"People are more likely to believe this claim if they suffered from an attachment disorder as a child – that is, if their parental attachment was abnormal.",Developmental,Abnormal
2014-03-16 12:10:33,2014-03-16 12:19:33,0,,540,1,2014-03-16 12:19:34,R_0oXtCqaIZ6H4s2V,,2,7,7,7,7,4,4,3,2,7,7,1,1,,,,,4,3,3,4,3,80,80,58,65,60,55,75,70,98,95,10,10,"1,3,4",,"4,5",1,2,43,No.  It wasn't hard.,The affects of personal beliefs in understanding psychological information?,3,2,1,1,Some diseases are caused by microorganisms called ‘germs’ that can infect a host organism.,7,some diseases are caused by germs,7,reject,false,true,"People are more likely to reject this claim if they have ""Type M neural activity"" in the ventral striatum cortex in their brain, which is the type of activity normally observed there.",Neuro,Normal
2014-03-16 12:43:01,2014-03-16 12:46:50,0,,229,1,2014-03-16 12:46:50,R_09EN3hdqVz9zE57,,2,6,5,4,7,5,6,6,6,7,7,4,1,5,6,6,6,,,,,2,70,70,60,60,60,70,80,50,90,90,50,40,9,dax,4,3,2,55,no,not sure,3,1,3,2,Killing animals for human consumption is morally wrong.,6,killing animals for human consumption is wrong,4,believe,true,false,"People are more likely to believe this claim if they do not have a mutated acfga2 gene – in other words, if their acfga2 gene is normal.",Genetic,Normal
2014-03-16 12:46:30,2014-03-16 12:56:25,0,,595,1,2014-03-16 12:56:26,R_9zzfqJPa4TiuuLb,,2,7,5,5,4,7,7,2,3,7,7,1,1,4,5,6,4,,,,,6,90,80,75,75,70,80,70,60,95,95,10,5,9,dax,"4,5",1,1,47,No problems.,Correlating individual beliefs to whether the individual believes others share the same beliefs.,3,2,3,1,Killing an innocent person is morally wrong.,11,killing an innocent person is wrong,7,reject,false,true,"People are more likely to reject this claim if they exhibit “cognitive biases in lexical processing” when reasoning, which is a type of processing that’s abnormal in these cases.",Psychological,Abnormal
2014-03-16 12:54:36,2014-03-16 13:03:43,0,,547,1,2014-03-16 13:03:43,R_3jY6XflRd7wnNlP,,2,7,6,7,2,7,7,1,1,7,7,1,1,,,,,4,2,4,4,1,100,50,75,50,95,75,50,75,99,100,2,2,"1,3,4,5",,"4,5",1,2,45,no,Peoples belief system,3,1,2,1,There is a God.,3,there is a God,7,believe,true,false,People are more likely to believe this claim if they frequently have “mini-seizures” in the ventral striatum cortex in the brain: this involves an abnormal pattern of activity.,Neuro,Abnormal
2014-03-16 13:00:33,2014-03-16 13:12:31,0,,718,1,2014-03-16 13:12:32,R_02IN55x8f8SMtJX,,2,6,6,4,5,5,6,4,4,7,7,1,1,,,,,4,4,4,4,3,100,100,75,50,70,80,20,60,100,100,25,25,9,dax,4,1,2,26,no,morals,3,2,1,2,Humans evolved via natural selection and share common ancestry with many other species.,8,humans evolved via natural selection,4,reject,false,true,"People are more likely to reject this claim if they did not suffer from an attachment disorder as a child – that is, if their parental attachment was normal.",Developmental,Normal
2014-03-16 13:21:21,2014-03-16 13:27:53,0,,392,1,2014-03-16 13:27:54,R_8qSNlp6kmoDsKCV,,2,7,7,7,7,1,1,2,2,7,7,5,5,3,4,4,4,,,,,2,90,95,50,65,35,70,65,60,100,100,20,20,9,dax,"4,5",2,2,34,no,"how we decide on what is right or wrong ",3,1,3,1,Killing an innocent person is morally wrong.,5,killing an innocent person is wrong,7,believe,true,false,"People are more likely to believe this claim if they have a mutated acfga2 gene – in other words, if their acfga2 gene is abnormal.",Genetic,Abnormal
2014-03-16 13:44:55,2014-03-16 13:49:19,0,,264,1,2014-03-16 13:49:20,R_25AYAxxMAeZIGsl,,2,6,6,6,2,7,7,2,7,6,6,2,2,,,,,2,2,7,7,1,80,60,50,20,50,10,20,30,60,60,30,10,9,dax,4,1,2,33,NA,I don't know,3,2,2,2,Every person has a soulmate or life partner who has been preselected for him or her by God or some other spiritual force in the universe.,10,every person has a soulmate,2,reject,false,true,"People are more likely to reject this claim if they have a mutated acfga2 gene – in other words, if their acfga2 gene is abnormal.",Genetic,Abnormal
2014-03-16 13:44:17,2014-03-16 13:50:22,0,,365,1,2014-03-16 13:50:23,R_eLQhpzbg8EgZRGt,,2,7,7,7,7,4,2,1,1,7,7,5,1,4,4,,4,,,,,6,40,40,45,65,75,70,70,70,30,30,25,5,9,dax,"4,5",1,2,63,,shared beliefs and how people decide things,3,2,2,1,There is a God.,9,there is a God,4,reject,false,true,"People are more likely to reject this claim if they engage in “Type M lexical processing” when reasoning, which is the type of processing normally engaged in these cases.",Psychological,Normal
2014-03-16 13:47:55,2014-03-16 13:54:41,0,,406,1,2014-03-16 13:54:41,R_6Xy6RXgQcJo5cyh,,2,6,6,7,5,1,5,1,1,7,7,4,1,,,,,4,5,4,4,4,95,90,50,50,60,80,55,45,90,75,8,2,9,dax,"1,4,5",1,2,26,No,"American moral/spiritual attitudes. ",3,1,3,1,Killing an innocent person is morally wrong.,5,killing an innocent person is wrong,7,believe,true,false,"People are more likely to believe this claim if they have ""Type M neural activity"" in the ventral striatum cortex in their brain, which is the type of activity normally observed there.",Neuro,Normal
2014-03-16 13:54:54,2014-03-16 14:02:22,0,,448,1,2014-03-16 14:02:23,R_0Dicoebl1zEmTxH,,2,5,6,4,4,7,5,4,4,6,6,2,2,5,5,5,4,,,,,6,80,80,30,50,75,95,60,75,85,90,10,15,9,dax,"4,5",1,2,33,No,Morals,3,1,2,2,Every person has a soulmate or life partner who has been preselected for him or her by God or some other spiritual force in the universe.,4,every person has a soulmate,4,believe,true,false,"People are more likely to believe this claim if they exhibit “cognitive biases in lexical processing” when reasoning, which is a type of processing that’s abnormal in these cases.",Psychological,Abnormal
2014-03-16 14:11:53,2014-03-16 14:20:16,0,,503,1,2014-03-16 14:20:17,R_b3DuNUeBSup9UfH,,2,7,6,4,2,6,6,4,6,7,7,4,2,3,4,4,4,,,,,3,90,90,65,50,90,50,65,75,98,98,25,25,9,dax,"4,5",1,2,42,no,beliefs and how we determine what we believe,3,1,3,2,Killing animals for human consumption is morally wrong.,6,killing animals for human consumption is wrong,4,believe,true,false,People are more likely to believe this claim if they frequently have “mini-seizures” in the ventral striatum cortex in the brain: this involves an abnormal pattern of activity.,Neuro,Abnormal
2014-03-16 14:13:35,2014-03-16 14:25:26,0,,711,1,2014-03-16 14:25:27,R_eqBpIB1TysNyqdD,,2,7,7,3,5,7,7,1,6,7,7,1,1,,,,,6,5,6,5,1,95,90,50,70,60,60,45,55,99,99,30,25,9,dax,"4,5",1,1,23,Nope. No problems.,"What percentage of people believe in the claims made in the survey and what they think the percentage of other people who believe in those claims are. ",3,1,2,1,There is a God.,3,there is a God,7,believe,true,false,"People are more likely to believe this claim if they do not have a mutated acfga2 gene – in other words, if their acfga2 gene is normal.",Genetic,Normal
2014-03-16 14:21:23,2014-03-16 14:26:57,0,,334,1,2014-03-16 14:26:58,R_809WXvIYUJEk67H,,2,7,7,7,7,7,7,7,7,7,7,1,1,4,3,4,4,,,,,4,100,100,50,50,40,40,98,40,100,100,10,10,"1,3,4",,5,1,2,23,,don't remember,2,2,3,1,Killing an innocent person is morally wrong.,11,killing an innocent person is wrong,7,reject,false,true,"People are more likely to reject this claim if they suffered from an attachment disorder as a child – that is, if their parental attachment was abnormal.",Developmental,Abnormal
2014-03-16 14:30:59,2014-03-16 14:31:17,0,,18,1,2014-03-16 14:31:18,R_2oDZDwmM6iYyO69,,1,,,,,,,,,,,,,,,,,,,,,,,,,,,,,,,,,,,,,,,,,,,,,,,,,,,,,,,
2014-03-16 14:30:01,2014-03-16 14:35:30,0,,329,1,2014-03-16 14:35:31,R_6ytD8bZ5NXILDRr,,2,7,7,1,2,7,7,7,7,7,6,1,1,,,,,4,4,4,4,1,99,80,50,75,99,95,99,99,100,97,5,10,9,dax,"4,5",1,2,43,no,no clue,3,1,1,2,Humans evolved via natural selection and share common ancestry with many other species.,2,humans evolved via natural selection,1,believe,true,false,"People are more likely to believe this claim if they did not suffer from an attachment disorder as a child – that is, if their parental attachment was normal.",Developmental,Normal
2014-03-16 14:32:08,2014-03-16 14:44:03,0,,715,1,2014-03-16 14:44:04,R_b1uvvc1crHBw3uR,,2,7,7,7,7,2,1,1,2,7,7,2,3,2,4,4,4,,,,,2,85,70,65,65,90,70,50,60,80,80,20,15,9,dax,"4,5",1,1,30,No,How people think providing an explanation for a belief will increase or decrease their confidence in the belief.,3,2,2,1,There is a God.,9,there is a God,2,reject,false,true,"People are more likely to reject this claim if they engage in “Type M lexical processing” when reasoning, which is the type of processing normally engaged in these cases.",Psychological,Normal
2014-03-16 14:33:41,2014-03-16 14:44:45,0,,664,1,2014-03-16 14:44:45,R_b1Pty7jUHSWCBSt,,2,6,6,6,6,6,4,4,4,7,7,3,2,,,,,3,4,3,3,2,95,90,90,75,75,70,50,50,99,99,15,10,9,dax,"4,5",3,2,37,I chose an answer that I did not agree with on the last question but could not go back to correct it.,"Something about how malleable a person's beliefs are when confronted with new, contradicting information?",3,1,1,1,Some diseases are caused by microorganisms called ‘germs’ that can infect a host organism.,1,some diseases are caused by germs,6,believe,true,false,"People are more likely to believe this claim if they exhibit “cognitive biases in lexical processing” when reasoning, which is a type of processing that’s abnormal in these cases.",Psychological,Abnormal
2014-03-16 14:33:37,2014-03-16 14:45:16,0,,699,1,2014-03-16 14:45:17,R_23FXdrqvnftedKt,,2,7,6,7,6,4,3,2,2,6,6,2,2,4,4,4,4,,,,,3,90,70,65,50,82,80,65,70,90,90,15,10,9,dax,"4,5",1,2,53,"It was a little confusing trying to answer the situations about the genetic normality, since it never stated whether the prerson (or I) had that genetic normality, nor whether we knew whether we had it.","Perhaps factors that shape people's opinions about various scientific and ""moral"" issues?",3,2,1,1,Some diseases are caused by microorganisms called ‘germs’ that can infect a host organism.,7,some diseases are caused by germs,7,reject,false,true,"People are more likely to reject this claim if they do not have a mutated acfga2 gene – in other words, if their acfga2 gene is normal.",Genetic,Normal
2014-03-17 10:03:37,2014-03-17 10:10:04,0,,387,1,2014-03-17 10:10:05,R_6soXIV6Kry3Xbpz,,2,7,7,6,7,2,1,2,1,7,7,5,5,,,,,2,3,2,2,5,40,25,25,50,85,85,75,85,97,96,35,15,9,dax,4,1,2,56,no problem,if people believe in God and what most people feel is ethical,3,1,2,2,Every person has a soulmate or life partner who has been preselected for him or her by God or some other spiritual force in the universe.,4,every person has a soulmate,2,believe,true,false,People are more likely to believe this claim if they frequently have “mini-seizures” in the ventral striatum cortex in the brain: this involves an abnormal pattern of activity.,Neuro,Abnormal
2014-03-17 10:02:06,2014-03-17 10:10:05,0,,479,1,2014-03-17 10:10:05,R_9TC9ji1ags8pzTv,,2,7,4,7,7,7,5,2,6,7,7,2,2,,,,,7,7,4,4,1,70,65,30,50,90,50,50,60,90,90,10,10,9,dax,4,1,2,30,No,"I believe it was about how people are influenced by beliefs based on the authority of the claim involved. ",3,2,1,2,Humans evolved via natural selection and share common ancestry with many other species.,8,humans evolved via natural selection,7,reject,false,true,"People are more likely to reject this claim if they did not suffer from an attachment disorder as a child – that is, if their parental attachment was normal.",Developmental,Normal
2014-03-17 10:03:18,2014-03-17 10:10:22,0,,424,1,2014-03-17 10:10:22,R_0jN6PJRAnM1XfkF,,2,7,6,7,6,2,2,1,1,6,7,2,2,,,,,4,4,3,4,2,99,60,50,50,80,80,60,70,99,99,30,20,9,dax,"4,5",1,2,22,no,religiousness and parental harm,3,2,3,2,Killing animals for human consumption is morally wrong.,12,killing animals for human consumption is wrong,2,reject,false,true,"People are more likely to reject this claim if they suffered from an attachment disorder as a child – that is, if their parental attachment was abnormal.",Developmental,Abnormal
2014-03-17 10:04:06,2014-03-17 10:10:22,0,,376,1,2014-03-17 10:10:22,R_7UQZ1j4CFpcY0Sx,,2,6,6,6,7,4,2,2,3,6,7,1,2,6,5,4,4,,,,,6,75,90,60,65,70,70,80,60,95,98,20,10,9,dax,"4,5",1,1,27,the wording with mike was a little confusing,Religion and how a belief can be influenced by facts.,3,1,3,1,Killing an innocent person is morally wrong.,5,killing an innocent person is wrong,6,believe,true,false,"People are more likely to believe this claim if they have a mutated acfga2 gene – in other words, if their acfga2 gene is abnormal.",Genetic,Abnormal
2014-03-17 10:04:43,2014-03-17 10:10:22,0,,339,1,2014-03-17 10:10:23,R_2sLUgERKKN6WA73,,2,6,6,6,2,4,4,3,5,7,7,3,2,,,,,4,3,4,4,5,85,85,60,35,50,45,40,35,90,95,30,35,9,dax,"4,5",1,1,24,None.,Your perceptions on general science vs religion opinions and your view on society's opinions as a whole.,3,2,2,2,Every person has a soulmate or life partner who has been preselected for him or her by God or some other spiritual force in the universe.,10,every person has a soulmate,3,reject,false,true,"People are more likely to reject this claim if they engage in “Type M lexical processing” when reasoning, which is the type of processing normally engaged in these cases.",Psychological,Normal
2014-03-17 10:04:59,2014-03-17 10:11:00,0,,361,1,2014-03-17 10:11:01,R_7WmElq2IfqRlZ0p,,2,5,6,5,5,1,1,1,1,7,6,2,1,5,4,4,5,,,,,5,85,75,45,35,70,70,65,65,98,89,25,20,9,dax,"4,5",1,1,25,no,meh,3,1,1,1,Some diseases are caused by microorganisms called ‘germs’ that can infect a host organism.,1,some diseases are caused by germs,5,believe,true,false,"People are more likely to believe this claim if they have ""Type M neural activity"" in the ventral striatum cortex in their brain, which is the type of activity normally observed there.",Neuro,Normal
2014-03-17 10:05:32,2014-03-17 10:11:34,0,,362,1,2014-03-17 10:11:35,R_2bObxfbES5jNpGt,,2,6,6,6,7,4,4,3,5,7,7,6,7,5,4,4,4,,,,,3,99,80,50,70,68,60,40,49,99,100,10,5,9,dax,"4,5",1,2,43,no,"I think this survey is about science and religious beliefs and if someone is less religious, do scientific facts sway them more. ",3,1,1,2,Humans evolved via natural selection and share common ancestry with many other species.,2,humans evolved via natural selection,6,believe,true,false,"People are more likely to believe this claim if they do not have a mutated acfga2 gene – in other words, if their acfga2 gene is normal.",Genetic,Normal
2014-03-17 10:02:48,2014-03-17 10:11:34,0,,526,1,2014-03-17 10:11:35,R_8vTJU5kgjoksaNf,,2,6,6,1,3,7,7,3,7,7,7,1,1,6,6,6,6,,,,,6,50,50,50,50,50,50,35,50,75,75,25,25,9,dax,4,1,2,56,,Individual beliefs and how they are influenced.,3,2,1,1,Some diseases are caused by microorganisms called ‘germs’ that can infect a host organism.,7,some diseases are caused by germs,6,reject,false,true,"People are more likely to reject this claim if they have ""Type M neural activity"" in the ventral striatum cortex in their brain, which is the type of activity normally observed there.",Neuro,Normal
2014-03-17 10:08:00,2014-03-17 10:11:38,0,,218,1,2014-03-17 10:11:39,R_d4POUKUPE8h7PJH,,2,7,7,7,7,2,1,1,1,7,7,2,2,,,,,6,5,3,3,3,95,95,83,85,29,3,13,10,100,100,14,5,9,dax,"4,5",1,2,25,No,How our beliefs shape our morals.,3,1,3,2,Killing animals for human consumption is morally wrong.,6,killing animals for human consumption is wrong,2,believe,true,false,"People are more likely to believe this claim if they have a mutated acfga2 gene – in other words, if their acfga2 gene is abnormal.",Genetic,Abnormal
2014-03-17 10:05:49,2014-03-17 10:12:05,0,,376,1,2014-03-17 10:12:06,R_1YydjR7DZNPGtOB,,2,7,7,7,4,1,1,1,1,1,4,1,1,,,,,4,4,4,4,4,90,90,70,50,75,75,60,70,60,50,20,10,9,dax,"4,5",1,2,22,No.,Beliefs,3,2,3,1,Killing an innocent person is morally wrong.,11,killing an innocent person is wrong,1,reject,false,true,"People are more likely to reject this claim if they did not suffer from an attachment disorder as a child – that is, if their parental attachment was normal.",Developmental,Normal
2014-03-17 10:05:19,2014-03-17 10:13:11,0,,472,1,2014-03-17 10:13:12,R_0NUpUeLLWAKx6nP,,2,5,6,5,5,7,6,3,5,7,7,2,2,2,4,4,4,,,,,5,75,75,50,50,75,50,50,50,90,90,10,10,9,dax,"4,5",1,1,27,No,Peoples beliefs and thoughts on what others believe.,3,2,2,1,There is a God.,9,there is a God,7,reject,false,true,"People are more likely to reject this claim if they engage in “Type M lexical processing” when reasoning, which is the type of processing normally engaged in these cases.",Psychological,Normal
2014-03-17 10:12:35,2014-03-17 10:15:12,0,,157,1,2014-03-17 10:15:13,R_egoDJlSODuyFLvv,,2,7,4,7,7,5,4,6,5,3,5,6,6,,,,,7,5,5,6,7,22,34,25,41,50,56,61,33,90,90,10,20,9,dax,"4,5",2,2,24,no,opinions,3,2,3,2,Killing animals for human consumption is morally wrong.,12,killing animals for human consumption is wrong,6,reject,false,true,"People are more likely to reject this claim if they exhibit “cognitive biases in lexical processing” when reasoning, which is a type of processing that’s abnormal in these cases.",Psychological,Abnormal
2014-03-17 10:07:23,2014-03-17 10:17:53,0,,630,1,2014-03-17 10:17:53,R_7UPpPN9MsOgQ789,,2,6,6,6,6,4,2,2,2,6,6,3,3,,,,,6,6,6,6,2,76,85,80,75,40,40,25,35,85,76,20,15,9,dax,"4,5",1,1,37,no,morals,3,2,1,2,Humans evolved via natural selection and share common ancestry with many other species.,8,humans evolved via natural selection,6,reject,false,true,"People are more likely to reject this claim if they suffered from an attachment disorder as a child – that is, if their parental attachment was abnormal.",Developmental,Abnormal
2014-03-17 10:08:18,2014-03-17 10:17:55,0,,577,1,2014-03-17 10:17:56,R_beIbIdK9DSeIIv3,,2,7,7,7,7,1,1,1,1,7,7,1,1,1,1,4,4,,,,,5,99,95,40,60,70,20,50,40,99,99,5,10,9,dax,"4,5",1,1,22,,Perceptions of human behavior.,3,1,2,1,There is a God.,3,there is a God,1,believe,true,false,People are more likely to believe this claim if they frequently have “mini-seizures” in the ventral striatum cortex in the brain: this involves an abnormal pattern of activity.,Neuro,Abnormal
2014-03-17 10:20:43,2014-03-17 10:25:39,0,,296,1,2014-03-17 10:25:40,R_bPz5FN29SXegV1j,,2,7,6,7,7,6,7,7,1,7,7,1,1,1,1,7,7,,,,,1,100,95,25,50,50,50,15,20,75,75,5,5,9,dax,"4,5",3,1,21,,our beliefs,2,2,3,1,Killing an innocent person is morally wrong.,11,killing an innocent person is wrong,7,reject,false,true,"People are more likely to reject this claim if they do not have a mutated acfga2 gene – in other words, if their acfga2 gene is normal.",Genetic,Normal
2014-03-17 12:45:08,2014-03-17 12:50:21,0,,313,1,2014-03-17 12:50:22,R_5b9gbq8bgCcKUWV,,2,5,4,5,5,1,5,3,4,7,7,2,5,,,,,5,6,5,6,3,800,100,60,50,70,30,50,30,100,100,20,10,9,dax,4,3,1,22,no,Ability to change opinion based on facts,3,2,1,2,Humans evolved via natural selection and share common ancestry with many other species.,8,humans evolved via natural selection,5,reject,false,true,"People are more likely to reject this claim if they engage in “Type M lexical processing” when reasoning, which is the type of processing normally engaged in these cases.",Psychological,Normal
2014-03-17 13:38:35,2014-03-17 13:44:50,0,,375,1,2014-03-17 13:44:51,R_3EmNirRXZgJXIjP,,2,7,2,7,7,1,1,1,1,7,7,7,7,,,,,1,4,4,1,5,99,80,80,50,90,80,50,70,99,99,10,05,"1,3,4",,"4,5",3,2,34,no,"If people who believe in supernatural gods are less ethically discerning toward their fellow animals, and have less understanding of the natural world, than people who do not derive their guidance or ethical values from a religion.",3,2,2,2,Every person has a soulmate or life partner who has been preselected for him or her by God or some other spiritual force in the universe.,10,every person has a soulmate,1,reject,false,true,"People are more likely to reject this claim if they have ""Type M neural activity"" in the ventral striatum cortex in their brain, which is the type of activity normally observed there.",Neuro,Normal
