StartDate,EndDate,Status,Progress,Duration (in seconds),Finished,RecordedDate,ResponseId,DistributionChannel,Q1,Q26_18,Q27_29,Q29,Q31,Q33,Q34,Q35,Q36,Q37,Q38,Q81,Q82,Q102,Q103,Q106,CommonUncommon,SeenText,ProperImproper,ReflectText
Start Date,End Date,Response Type,Progress,Duration (in seconds),Finished,Recorded Date,Response ID,Distribution Channel,"Consent to Participate in Research

 

Concepts and Cognition Experiment

 

CPHS# 2013-09-5632

 

This HIT is a psychology experiment being conducted by Dillon Plunkett, a graduate student at Harvard University working in collaboration with Professor Tania Lombrozo’s Concepts and Cognition Lab at the University of California, Berkeley. In order to consent to participate, you MUST meet the following criteria:

 


	18 years of age or older.
	Fluent speaker of English.
	Have not participated in this experiment before.


 

This study is designed to test hypotheses about the nature of people's intuitive theories about the world, how they can be changed, and how they influence judgments and behavior. We also hope to learn about how you conceptually understand the world around you. Our intuitive sense of everyday objects and events in the world play a significant role in our thoughts and behaviors, and we wish to understand the nature of human cognition.

 

You may be asked to do one or more of the following tasks 1) causal learning tasks (e.g., figuring out what causes what), 2) social tasks (e.g., reasoning about others’ minds and behavior), 3) linguistic tasks (e.g., word associations and learning), 4) imagination tasks (e.g., reasoning about events counter to fact), 5) categorization/association tasks (e.g., grouping objects or stating what comes to mind given a prompt), 6) general cognitive tasks (e.g., impulse control and searching for hidden objects). You may be asked to make judgments about what you see, answer multiple choice or open-ended questions about your judgments (such as making predictions and providing explanations), observe events, and perform actions yourself (such as grouping objects). Sometimes you might watch a short video clip, look at pictures, or listen to music, and you may be asked to answer questions about how the clip or music made you feel.

You may refrain from answering any questions that make you uncomfortable and may withdraw your participation at any time even after completing the experiment without penalty. 

 

The study takes about 6 minutes to complete, for which you will receive $0.75. There are no direct benefits to you as a participant, but this research will help us understand various cognitive processes, which may benefit society in a number of ways, including influencing legal and public policy. 

 

We will not be asking for any personally identifying information, and we will handle responses as confidentially as possible. Worker IDs will never be tied to your responses on this survey, and IP addresses will not be collected for studies that ask potentially sensitive questions. However, we cannot guarantee the confidentiality of information transmitted over the Internet. To minimize this risk, data containing anything that might be personally identifiable (e.g. Worker IDs) will be encrypted on transfer and storage and will only be accessible to qualified lab personnel. We will be keeping data collected as part of this experiment indefinitely. This anonymized data (containing neither Worker IDs nor IP addresses) may be shared with the scientific community.

 

If you have any questions about the study, feel free to contact the study investigator: Dillon Plunkett at plunkett@g.harvard.edu, or the principal investigator: Tania Lombrozo at lombrozo@berkeley.edu. If you have concerns about your rights as a participant in this experiment, please contact UC Berkeley’s Committee for Protection of Human Subjects at (510) 642-7461 or subjects@berkeley.edu.

 

By selecting the “consent” option below, I acknowledge that I am 18 or older, that I am a fluent speaker of English, that I have not completed this experiment before, that I have read this consent form, and that I agree to take part in the research.","On a 1 to 7 scale where 1 represents “I am a confident atheist” and 7 represents “I am a confident believer”, to what extent do you believe that God exists? - To what extent do you believe that God exists?","On a 1 to 7 scale where 1 represents ""no confidence whatsoever"" and 7 represents ""total confidence,"" how much confidence do you place in the existing
evidence that shows a connection between activity in the temporal lobe and
belief in God? - Confidence in existing evidence","Before participating in this study, had you
previously heard that there is a connection between activity in the temporal
lobe and belief in God?","What effect do you think learning this would
have on Michael’s belief about whether there is a God?",What effect do you think learning this should have on Michael’s belief about whether there is a God?,"How plausible do you think results of the new
study are?","Regardlessof how plausible you think the results of the new study are, how real","According to the new study, how common was the
pattern of temporal lobe activity associated with belief in God?","According to the new study, which of the
following was true about the pattern of temporal lobe activity associated with
belief in God?",Did the new study agree with the evidence we currently have about the connection between the temporal lobes and religious belief or contradict the evidence we currently have?,What is your sex?,What is your age?,"Did you have any problems with this survey? For example, did something seem to appear incorrectly or was anything confusing?",What do you think this survey is about?,Have you completed this survey or one very similar to it before? (We will credit you either way. Please be honest.),CommonUncommon,SeenText,ProperImproper,ReflectText
"{""ImportId"":""startDate""}","{""ImportId"":""endDate""}","{""ImportId"":""status""}","{""ImportId"":""progress""}","{""ImportId"":""duration""}","{""ImportId"":""finished""}","{""ImportId"":""recordedDate""}","{""ImportId"":""_recordId""}","{""ImportId"":""distributionChannel""}","{""ImportId"":""QID1""}","{""ImportId"":""QID123_18""}","{""ImportId"":""QID124_29""}","{""ImportId"":""QID126""}","{""ImportId"":""QID128""}","{""ImportId"":""QID130""}","{""ImportId"":""QID131""}","{""ImportId"":""QID132""}","{""ImportId"":""QID133""}","{""ImportId"":""QID134""}","{""ImportId"":""QID135""}","{""ImportId"":""QID81""}","{""ImportId"":""QID82_TEXT""}","{""ImportId"":""QID102_TEXT""}","{""ImportId"":""QID103_TEXT""}","{""ImportId"":""QID106""}","{""ImportId"":""CommonUncommon""}","{""ImportId"":""SeenText""}","{""ImportId"":""ProperImproper""}","{""ImportId"":""ReflectText""}"
2017-03-25 11:16:51,2017-03-25 11:17:32,0,100,40,1,2017-03-25 11:17:33,R_3EuT6bfwG9aXKd7,anonymous,2,5,5,3,2,2,5,3,4,1,2,1,21,NO,"not sure ",1,uncommon,seen in a minority of people,proper,the operation of a brain system doing what it evolved to do
2017-03-25 11:47:50,2017-03-25 11:48:45,0,100,55,1,2017-03-25 11:48:47,R_1LbfcShhar8fcgr,anonymous,2,5,7,2,5,3,6,4,3,2,1,1,24,no,unsure,3,common,seen in a large majority of people,improper,a defect in the operation of a brain system
2017-03-25 11:46:58,2017-03-25 11:49:45,0,100,167,1,2017-03-25 11:49:47,R_2tuii5WwDtSLfnm,anonymous,2,4,4,4,3,3,3,5,2,2,1,2,56,,,3,common,seen in a large majority of people,improper,a defect in the operation of a brain system
2017-03-25 11:48:19,2017-03-25 11:51:05,0,100,165,1,2017-03-25 11:51:06,R_5aRYs4REQUvg3o5,anonymous,2,5,4,4,6,4,5,6,4,1,1,1,26,"No, everything functioned properly.","I would guess how we reconcile our religious beliefs? Not sure, honestly.",3,uncommon,seen in a minority of people,proper,the operation of a brain system doing what it evolved to do
2017-03-25 11:48:28,2017-03-25 11:52:04,0,100,216,1,2017-03-25 11:52:05,R_BStv6weVd1vGhQR,anonymous,2,7,3,4,6,6,5,5,1,1,1,2,52,no,I don't know,3,uncommon,seen in a minority of people,improper,a defect in the operation of a brain system
2017-03-25 11:51:14,2017-03-25 11:52:57,0,100,102,1,2017-03-25 11:52:59,R_3pgvsgNJ38QfiZg,anonymous,2,4,2,4,3,4,5,5,2,1,2,1,26,no,unsure,3,uncommon,seen in a minority of people,proper,the operation of a brain system doing what it evolved to do
2017-03-25 11:49:48,2017-03-25 11:53:12,0,100,204,1,2017-03-25 11:53:14,R_3huWoKYN1D4t1hm,anonymous,2,7,7,4,7,7,6,6,1,1,1,2,40,"Everything was working well. ","People's belief system. ",3,common,seen in a large majority of people,proper,the operation of a brain system doing what it evolved to do
2017-03-25 12:00:46,2017-03-25 12:02:45,0,100,119,1,2017-03-25 12:02:46,R_1jTeQI7UoC5OjpT,anonymous,2,2,3,4,3,4,2,3,4,2,2,2,22,no,I don't know,3,uncommon,seen in a minority of people,improper,a defect in the operation of a brain system
2017-03-25 12:00:03,2017-03-25 12:03:01,0,100,177,1,2017-03-25 12:03:03,R_85HNzTvsFGBW7vP,anonymous,2,3,5,4,4,2,6,6,1,2,2,1,56,no,not sure,3,common,seen in a large majority of people,improper,a defect in the operation of a brain system
2017-03-25 12:05:37,2017-03-25 12:05:57,0,100,20,1,2017-03-25 12:05:59,R_2at0L2Rfa8f44lv,anonymous,1,,,,,,,,,,,,,,,,,,,
2017-03-25 12:05:59,2017-03-25 12:06:02,0,100,3,1,2017-03-25 12:06:03,R_1LclSjogy2XNCUq,anonymous,1,,,,,,,,,,,,,,,,,,,
2017-03-25 12:07:24,2017-03-25 12:07:43,0,100,18,1,2017-03-25 12:07:44,R_3JIT9AN1yrg9mgq,anonymous,1,,,,,,,,,,,,,,,,,,,
2017-03-25 12:07:48,2017-03-25 12:07:52,0,100,4,1,2017-03-25 12:07:54,R_3qPuf9CCDIr6syd,anonymous,1,,,,,,,,,,,,,,,,,,,
2017-03-25 12:06:16,2017-03-25 12:07:54,0,100,97,1,2017-03-25 12:07:56,R_1nSGf0HFmQ4WDr8,anonymous,2,5,2,4,4,6,3,2,3,1,1,2,27,,,3,uncommon,seen in a minority of people,proper,the operation of a brain system doing what it evolved to do
2017-03-25 12:06:17,2017-03-25 12:07:56,0,100,99,1,2017-03-25 12:07:58,R_3kuDGZlaJ66Nldy,anonymous,2,2,5,3,4,4,6,5,2,1,1,1,28,,unsure,3,common,seen in a large majority of people,proper,the operation of a brain system doing what it evolved to do
2017-03-25 12:06:17,2017-03-25 12:07:59,0,100,102,1,2017-03-25 12:08:00,R_1qVVbHYUrHzC8RP,anonymous,2,6,6,2,4,5,5,5,4,2,1,2,30,none,How we feel our belief in God would change based on scientific evidence.,3,uncommon,seen in a minority of people,proper,the operation of a brain system doing what it evolved to do
2017-03-25 12:05:52,2017-03-25 12:08:02,0,100,129,1,2017-03-25 12:08:03,R_2rVFb733TN1sIUy,anonymous,2,3,5,4,3,3,5,4,1,1,1,1,35,no,if I think that mentally unfit people are more likely to believe in God?,3,common,seen in a large majority of people,proper,the operation of a brain system doing what it evolved to do
2017-03-25 12:07:01,2017-03-25 12:08:04,0,100,62,1,2017-03-25 12:08:05,R_2QMauvbjWvN462D,anonymous,2,5,3,2,4,4,5,3,2,1,1,1,22,no,survey stuff,3,uncommon,seen in a minority of people,proper,the operation of a brain system doing what it evolved to do
2017-03-25 12:06:46,2017-03-25 12:08:07,0,100,81,1,2017-03-25 12:08:09,R_SDEigfIL807n8VH,anonymous,2,6,5,3,5,4,6,5,2,1,1,1,25,,religious reasons,3,uncommon,seen in a minority of people,improper,a defect in the operation of a brain system
2017-03-25 12:06:44,2017-03-25 12:08:07,0,100,83,1,2017-03-25 12:08:09,R_RrYhpbTkxZXbcd3,anonymous,2,1,1,4,4,4,4,4,2,2,2,1,39,no,about how people form relationships with god,3,common,seen in a large majority of people,proper,the operation of a brain system doing what it evolved to do
2017-03-25 12:06:34,2017-03-25 12:08:44,0,100,130,1,2017-03-25 12:08:46,R_1RMH5T9mSpUd5MB,anonymous,2,1,6,2,4,2,6,6,2,2,1,1,34,,perceptions of beliefs,3,common,seen in a large majority of people,improper,a defect in the operation of a brain system
2017-03-25 12:06:07,2017-03-25 12:08:44,0,100,157,1,2017-03-25 12:08:46,R_1eVr5HdiY9phgkl,anonymous,2,1,1,3,4,4,5,5,1,2,1,1,27,,I think the survey is about finding how people process information.,3,common,seen in a large majority of people,improper,a defect in the operation of a brain system
2017-03-25 12:08:34,2017-03-25 12:08:46,0,100,12,1,2017-03-25 12:08:48,R_2VfMl4ntFzQVQVA,anonymous,1,,,,,,,,,,,,,,,,,,,
2017-03-25 12:06:12,2017-03-25 12:08:49,0,100,156,1,2017-03-25 12:08:50,R_1ghmMVIeYuRGDPp,anonymous,2,2,6,4,4,2,5,3,2,2,1,2,27,,God,3,uncommon,seen in a minority of people,improper,a defect in the operation of a brain system
2017-03-25 12:06:34,2017-03-25 12:08:50,0,100,136,1,2017-03-25 12:08:52,R_2qeXsQkEph9GkM8,anonymous,2,5,5,4,6,6,5,6,1,1,1,2,43,No,Whether people actually believe scientific studies.,3,common,seen in a large majority of people,improper,a defect in the operation of a brain system
2017-03-25 12:06:21,2017-03-25 12:08:55,0,100,154,1,2017-03-25 12:08:57,R_2sbsUumvfVPJPQk,anonymous,2,2,4,4,5,5,3,3,1,1,1,1,34,,showing that science and religion are not mutually exclusive,3,common,seen in a large majority of people,proper,the operation of a brain system doing what it evolved to do
2017-03-25 12:05:59,2017-03-25 12:09:06,0,100,186,1,2017-03-25 12:09:08,R_1rlw7JYP1oaNGKU,anonymous,2,1,3,4,4,2,3,5,4,2,1,1,30,,I'm not sure.,3,uncommon,seen in a minority of people,improper,a defect in the operation of a brain system
2017-03-25 12:07:15,2017-03-25 12:09:12,0,100,117,1,2017-03-25 12:09:14,R_3mmgPmg14MuznOZ,anonymous,2,7,1,4,7,7,1,1,4,1,1,2,52,,Belief in God,3,common,seen in a large majority of people,improper,a defect in the operation of a brain system
2017-03-25 12:06:58,2017-03-25 12:09:16,0,100,138,1,2017-03-25 12:09:17,R_2QALI4YEH9ovEUx,anonymous,2,7,1,4,4,4,6,3,1,1,1,1,31,no,perception of faith and science,3,common,seen in a large majority of people,proper,the operation of a brain system doing what it evolved to do
2017-03-25 12:07:01,2017-03-25 12:09:18,0,100,136,1,2017-03-25 12:09:19,R_2TX10fVaIfjnrtb,anonymous,2,1,4,4,2,1,3,5,4,1,1,2,25,Nope,I liked it :),3,uncommon,seen in a minority of people,proper,the operation of a brain system doing what it evolved to do
2017-03-25 12:06:35,2017-03-25 12:09:19,0,100,163,1,2017-03-25 12:09:20,R_1r1UjDvJpY11tyl,anonymous,2,4,1,4,4,4,4,5,2,1,1,1,34,no nothing,belief in god,3,common,seen in a large majority of people,proper,the operation of a brain system doing what it evolved to do
2017-03-25 12:06:04,2017-03-25 12:09:27,0,100,203,1,2017-03-25 12:09:28,R_0MWNyHeVoGv1jR7,anonymous,2,6,5,4,3,2,5,3,2,1,2,1,31,This survey worked great for me.,I believe that this study was to have an effect on your religious beliefs.,3,uncommon,seen in a minority of people,proper,the operation of a brain system doing what it evolved to do
2017-03-25 12:07:02,2017-03-25 12:09:28,0,100,145,1,2017-03-25 12:09:29,R_1pJq2ti0twMsIhh,anonymous,2,3,4,4,6,5,6,4,1,1,1,2,33,no,I am not sure,3,uncommon,seen in a minority of people,improper,a defect in the operation of a brain system
2017-03-25 12:07:17,2017-03-25 12:09:30,0,100,132,1,2017-03-25 12:09:31,R_1MKGNwngwF2p4n2,anonymous,2,5,5,4,4,4,3,3,2,2,1,2,23,,,3,common,seen in a large majority of people,improper,a defect in the operation of a brain system
2017-03-25 12:06:54,2017-03-25 12:09:32,0,100,158,1,2017-03-25 12:09:34,R_1ery1HiaLLhe89L,anonymous,2,7,7,4,4,4,1,1,2,2,2,1,39,The study was a little confusing to me,I think God is real regardless of a temporal lobe study.,3,common,seen in a large majority of people,improper,a defect in the operation of a brain system
2017-03-25 12:07:06,2017-03-25 12:09:39,0,100,153,1,2017-03-25 12:09:40,R_2dlLrSDkKFc7VQl,anonymous,2,2,3,4,4,3,5,6,1,1,1,1,24,,A hypothetical research study & how plausible or implausible it is,3,common,seen in a large majority of people,proper,the operation of a brain system doing what it evolved to do
2017-03-25 12:06:52,2017-03-25 12:09:45,0,100,173,1,2017-03-25 12:09:47,R_bpAYDbPqPY8p7pL,anonymous,2,2,4,4,4,4,3,5,1,1,1,1,45,I may have gotten 1 or 2 of the comprehension checks wrong; I'm not sure.,Would scientific evidence bolster or undermine religious faith?,3,common,seen in a large majority of people,proper,the operation of a brain system doing what it evolved to do
2017-03-25 12:07:18,2017-03-25 12:09:46,0,100,148,1,2017-03-25 12:09:48,R_2SDC6dSPT7w22F1,anonymous,2,2,3,4,4,2,5,3,2,1,2,2,27,No,"Does got really exist or is it all in our heads. ",3,uncommon,seen in a minority of people,improper,a defect in the operation of a brain system
2017-03-25 12:06:35,2017-03-25 12:09:48,0,100,193,1,2017-03-25 12:09:49,R_1Kj7LFMyPii2tnR,anonymous,2,2,4,4,4,3,5,5,1,2,1,2,38,No.,Beliefs in validity of scientific theories in relation to whether or not a person believes in God.,3,common,seen in a large majority of people,improper,a defect in the operation of a brain system
2017-03-25 12:06:09,2017-03-25 12:09:50,0,100,221,1,2017-03-25 12:09:52,R_1QGY8QU2LObjfWR,anonymous,2,1,5,4,6,4,6,7,1,1,1,2,23,No,I'm not sure!,3,common,seen in a large majority of people,proper,the operation of a brain system doing what it evolved to do
2017-03-25 12:06:40,2017-03-25 12:09:53,0,100,192,1,2017-03-25 12:09:55,R_3Ej43m4nOIV3WyH,anonymous,2,7,4,4,4,4,2,3,4,1,1,1,67,no problems,I don't know,3,uncommon,seen in a minority of people,proper,the operation of a brain system doing what it evolved to do
2017-03-25 12:06:57,2017-03-25 12:10:02,0,100,185,1,2017-03-25 12:10:04,R_2pWsuQWr8sR8sDr,anonymous,2,7,7,4,4,4,1,1,1,2,1,2,30,,science and belief,3,common,seen in a large majority of people,improper,a defect in the operation of a brain system
2017-03-25 12:06:29,2017-03-25 12:10:04,0,100,215,1,2017-03-25 12:10:06,R_1jO1rnSLc9JfHcR,anonymous,2,1,4,4,6,6,5,3,4,1,1,2,25,none,About how people understand study findings and whether or not they believe them based on their own beliefs,3,uncommon,seen in a minority of people,proper,the operation of a brain system doing what it evolved to do
2017-03-25 12:08:41,2017-03-25 12:10:14,0,100,92,1,2017-03-25 12:10:15,R_1Qc3Prtt4w2GQjO,anonymous,2,1,1,4,5,5,2,1,2,2,1,2,30,no issues,beliefs of god and science,3,common,seen in a large majority of people,improper,a defect in the operation of a brain system
2017-03-25 12:07:15,2017-03-25 12:10:16,0,100,180,1,2017-03-25 12:10:17,R_2TzRhJVp18VII4z,anonymous,2,1,6,3,4,4,5,6,4,1,1,1,55,,a scientific basis for religious experience,3,uncommon,seen in a minority of people,proper,the operation of a brain system doing what it evolved to do
2017-03-25 12:05:48,2017-03-25 12:10:17,0,100,269,1,2017-03-25 12:10:19,R_R8IoB6slmnFq0Lf,anonymous,2,6,2,4,4,4,5,3,1,1,1,1,44,no problems,understanding people's feelings about belief,3,common,seen in a large majority of people,proper,the operation of a brain system doing what it evolved to do
2017-03-25 12:09:12,2017-03-25 12:10:19,0,100,66,1,2017-03-25 12:10:20,R_Azk2ubE5pGx8reN,anonymous,2,5,5,2,5,4,5,5,3,1,1,1,24,none,personality,3,uncommon,seen in a minority of people,proper,the operation of a brain system doing what it evolved to do
2017-03-25 12:07:33,2017-03-25 12:10:19,0,100,165,1,2017-03-25 12:10:20,R_3fdeVeYf4qYmXQF,anonymous,2,7,6,3,4,3,5,5,4,2,1,2,58,no,I don't know.,3,uncommon,seen in a minority of people,improper,a defect in the operation of a brain system
2017-03-25 12:08:02,2017-03-25 12:10:22,0,100,139,1,2017-03-25 12:10:23,R_3CEgSo7Y1Sc9clG,anonymous,2,4,3,4,6,6,4,5,2,1,1,1,37,no,beliefs about scientific findings,3,uncommon,seen in a minority of people,proper,the operation of a brain system doing what it evolved to do
2017-03-25 12:08:26,2017-03-25 12:10:24,0,100,117,1,2017-03-25 12:10:25,R_1P6NMO96QMt3FYp,anonymous,2,1,7,2,4,1,7,7,4,2,1,2,48,,,3,uncommon,seen in a minority of people,improper,a defect in the operation of a brain system
2017-03-25 12:05:56,2017-03-25 12:10:23,0,100,267,1,2017-03-25 12:10:25,R_2AWFoWRvZbourgI,anonymous,2,2,7,4,7,4,6,7,1,1,1,1,31,no,"The correlation between brain activity and belief system, and how it reinforces a person's beliefs",3,common,seen in a large majority of people,proper,the operation of a brain system doing what it evolved to do
2017-03-25 12:09:16,2017-03-25 12:10:25,0,100,69,1,2017-03-25 12:10:26,R_erFzF6NrJIDjgZP,anonymous,1,,,,,,,,,,,,,,,,,,,
2017-03-25 12:06:31,2017-03-25 12:10:30,0,100,239,1,2017-03-25 12:10:32,R_1I5h4SI07VrUFvC,anonymous,2,2,5,4,6,4,6,7,4,1,1,2,33,No,to see how people identify with beliefs?,3,uncommon,seen in a minority of people,proper,the operation of a brain system doing what it evolved to do
2017-03-25 12:09:12,2017-03-25 12:10:31,0,100,79,1,2017-03-25 12:10:32,R_RVJLAHJFe2PABgd,anonymous,1,,,,,,,,,,,,,,,,,,,
2017-03-25 12:06:21,2017-03-25 12:10:30,0,100,249,1,2017-03-25 12:10:33,R_6m7CI6A5G0ZhxTP,anonymous,2,6,5,4,4,4,5,3,4,2,2,1,27,No,If people are willing to change their views on religion based on research,3,uncommon,seen in a minority of people,improper,a defect in the operation of a brain system
2017-03-25 12:06:28,2017-03-25 12:10:33,0,100,245,1,2017-03-25 12:10:35,R_XQYBFGJdzWVcSCl,anonymous,2,7,6,4,4,4,4,3,1,1,1,2,57,none,belief in God and the effects on the mind,3,common,seen in a large majority of people,improper,a defect in the operation of a brain system
2017-03-25 12:07:25,2017-03-25 12:10:33,0,100,187,1,2017-03-25 12:10:35,R_zeEU3P8s5rD8Re9,anonymous,2,2,6,3,4,2,6,6,1,1,1,1,45,no,dunno,3,common,seen in a large majority of people,proper,the operation of a brain system doing what it evolved to do
2017-03-25 12:06:14,2017-03-25 12:10:36,0,100,262,1,2017-03-25 12:10:37,R_UK0ZKP1LTXp3Bux,anonymous,2,6,3,4,3,4,2,3,1,2,1,1,27,no,To understand how people perceive evidence that suggests that belief in God is the result of improper functioning of the temporal lobe.,3,uncommon,seen in a minority of people,improper,a defect in the operation of a brain system
2017-03-25 12:07:44,2017-03-25 12:10:38,0,100,173,1,2017-03-25 12:10:39,R_2rx9OjvwVonf1sG,anonymous,2,1,4,4,6,4,4,2,2,1,1,1,31,no,whether things can change our thoughts or make our thoughts stronger about a belief,3,uncommon,seen in a minority of people,improper,a defect in the operation of a brain system
2017-03-25 12:05:59,2017-03-25 12:10:48,0,100,288,1,2017-03-25 12:10:49,R_2ydZnl6WkDDWDYW,anonymous,2,7,7,4,4,7,7,7,4,2,1,1,28,na,belief in God.,3,uncommon,seen in a minority of people,improper,a defect in the operation of a brain system
2017-03-25 12:06:23,2017-03-25 12:10:54,0,100,270,1,2017-03-25 12:10:55,R_BXRqj7nRwaDZ9L3,anonymous,2,1,5,4,7,4,3,3,1,1,1,1,44,None,No Idea,3,uncommon,seen in a minority of people,improper,a defect in the operation of a brain system
2017-03-25 12:08:04,2017-03-25 12:10:53,0,100,169,1,2017-03-25 12:10:55,R_UryZpf7mCQ0qQhP,anonymous,2,2,5,4,2,2,6,5,2,1,1,1,24,,Our reliability and trust in modern science and research.,3,uncommon,seen in a minority of people,proper,the operation of a brain system doing what it evolved to do
2017-03-25 12:08:25,2017-03-25 12:10:55,0,100,150,1,2017-03-25 12:10:57,R_0v8FYiXTXALkb8B,anonymous,2,1,1,4,4,4,2,1,3,1,1,1,58,no,Religious beliefs,3,uncommon,seen in a minority of people,proper,the operation of a brain system doing what it evolved to do
2017-03-25 12:06:10,2017-03-25 12:10:58,0,100,288,1,2017-03-25 12:11:00,R_3m8uFLP67ws9rnr,anonymous,2,3,5,4,4,3,6,5,4,2,1,1,34,No problems at all,Whether facts decrease belief.,3,uncommon,seen in a minority of people,improper,a defect in the operation of a brain system
2017-03-25 12:08:55,2017-03-25 12:10:59,0,100,123,1,2017-03-25 12:11:01,R_2U32mYsxVZfJTEY,anonymous,2,2,2,4,3,4,3,2,1,2,1,1,26,,,3,common,seen in a large majority of people,improper,a defect in the operation of a brain system
2017-03-25 12:07:33,2017-03-25 12:11:02,0,100,208,1,2017-03-25 12:11:03,R_1LLK5nTmLPtk6uh,anonymous,2,2,5,4,4,3,5,6,2,1,1,1,30,I was a little confused but It might have been my fault reading it wrong.,How much we are able to shift our views.,3,common,seen in a large majority of people,proper,the operation of a brain system doing what it evolved to do
2017-03-25 12:06:53,2017-03-25 12:11:03,0,100,250,1,2017-03-25 12:11:05,R_U9Me9jHAmPlEMyB,anonymous,2,1,5,4,4,5,3,5,4,2,1,1,38,No.,I think this survey is about brain structures and its correlation to peoples' belief in God.,3,uncommon,seen in a minority of people,improper,a defect in the operation of a brain system
2017-03-25 12:07:27,2017-03-25 12:11:05,0,100,217,1,2017-03-25 12:11:07,R_eY7PsucqHuROAkF,anonymous,2,7,6,4,4,4,4,6,1,1,1,2,32,no problems,research,3,common,seen in a large majority of people,proper,the operation of a brain system doing what it evolved to do
2017-03-25 12:08:13,2017-03-25 12:11:12,0,100,179,1,2017-03-25 12:11:14,R_2xzWsyTeoi70oIf,anonymous,2,7,4,4,3,3,2,2,3,2,2,1,23,no,if people would still believe in god,3,uncommon,seen in a minority of people,improper,a defect in the operation of a brain system
2017-03-25 12:07:33,2017-03-25 12:11:14,0,100,221,1,2017-03-25 12:11:16,R_27jOyuIL1db6LbV,anonymous,2,1,5,4,3,1,7,7,1,2,1,1,29,,I think you are trying to understand how the presentation of scientific findings effect how people think others will react to that information.,3,common,seen in a large majority of people,improper,a defect in the operation of a brain system
2017-03-25 12:06:07,2017-03-25 12:11:15,0,100,308,1,2017-03-25 12:11:17,R_x57fKbHdbyX47nj,anonymous,2,2,2,4,6,6,4,3,1,2,1,2,39,no,not sutr,3,common,seen in a large majority of people,improper,a defect in the operation of a brain system
2017-03-25 12:07:59,2017-03-25 12:11:19,0,100,199,1,2017-03-25 12:11:21,R_1IsWUMeMt8kLDTU,anonymous,2,2,5,3,5,4,5,4,1,1,1,2,30,"No, it seemed clear to me.","It was obviously about whether I believe in God, how I view research about belief and how I predict others would view the same research. What exactly you predict the correlation among those things is, I'm not sure.",3,common,seen in a large majority of people,proper,the operation of a brain system doing what it evolved to do
