StartDate,EndDate,Status,Progress,Duration (in seconds),Finished,RecordedDate,ResponseId,DistributionChannel,Q1,Q108_1,Q108_2,Q108_3,Q108_4,Q108_5,Q108_6,Q108_7,Q108_8,Q108_9,Q108_10,Q108_11,Q108_12,Q100,Q14,Q14,Q17,Q101_1_1,Q101_2_1,Q101_3_1,Q101_4_1,Q101_5_1,Q101_6_1,Q101_7_1,Q101_8_1,Q101_9_1,Q101_10_1,Q101_11_1,Q101_12_1,Q13,Q13_9_TEXT,Q81,Q82,Q102,Q103,Q106,AcceptReject,SciRelMor,CommonRare,Claim,ClaimSet,Whether,TargetRating,True,Do,NormallyAbnormally,Domain
2013-12-25 16:38:40,2013-12-25 16:45:06,0,,386,1,2013-12-25 16:45:06,R_ahFeWvBRQrJ7aKx,,2,6,6,4,5,7,6,4,5,7,7,2,2,7,7,7,7,80,80,60,80,45,50,50,40,99,80,25,25,9,dax,1,27,no,no idea,3,2,2,1,There is a God.,9,there is a God,7,true,do,normally,religious
2013-12-25 16:43:13,2013-12-25 16:45:53,0,,160,1,2013-12-25 16:45:53,R_b2z01DyIuhCJzGl,,2,7,7,6,7,1,1,2,1,4,7,1,1,4,4,4,4,85,60,60,60,50,35,25,35,60,50,15,15,9,dax,1,19,none,unsure,3,1,2,1,There is a God.,3,there is a God,1,true,do,normally,religious
2013-12-25 16:36:18,2013-12-25 16:46:15,0,,597,1,2013-12-25 16:46:15,R_4GHFIUuanKVtEwt,,2,7,7,7,6,5,4,2,1,6,7,4,3,5,4,5,4,90,90,50,60,50,40,60,20,90,20,30,30,9,dax,1,22,no problem,how can unrelated  data might influence our beliefs,3,1,1,1,Some diseases are caused by microorganisms called ‘germs’ that can infect a host organism.,1,some diseases are caused by germs,7,true,do,normally,scientific
2013-12-25 16:43:10,2013-12-25 16:47:29,0,,259,1,2013-12-25 16:47:29,R_8BmExu3CrFkozuR,,2,6,6,7,6,2,2,3,3,6,6,4,3,6,7,4,5,80,70,40,60,80,80,85,85,95,95,30,20,9,dax,2,25,Nope,Beliefs about scientific perceptions and attitudes,3,2,1,1,Some diseases are caused by microorganisms called ‘germs’ that can infect a host organism.,7,some diseases are caused by germs,6,true,do,normally,scientific
2013-12-25 12:46:49,2013-12-25 12:49:46,0,,177,0,2013-12-25 16:49:59,R_cNo2E9iN7QeG2QR,,2,6,7,7,6,7,7,7,7,7,7,2,1,5,5,,,,,,,,,,,,,,,,,,,,,,2,2,2,Every person has a soulmate or life partner who has been preselected for him or her by God or some other spiritual force in the universe.,10,every person has a soulmate,7,true,do,normally,religious
2013-12-25 16:49:54,2013-12-25 16:54:25,0,,271,1,2013-12-25 16:54:25,R_b7LWa1AHwiRqIMl,,2,6,4,6,1,1,1,1,1,7,7,1,1,4,4,4,4,100,75,50,20,75,50,30,30,90,90,10,10,9,dax,1,62,,tying moral beliefs to physical characteristics,3,2,3,1,Killing an innocent person is morally wrong.,11,killing an innocent person is wrong,7,true,do,abnormally,moral
2013-12-25 16:52:37,2013-12-25 16:56:53,0,,256,1,2013-12-25 16:56:54,R_4Si1w4XbWgJJciN,,2,7,7,4,7,5,4,2,3,7,7,6,1,7,7,6,6,85,85,50,50,65,50,50,45,100,100,20,10,9,dax,2,29,,thoughts on morality and whether it is learned or physiologically ingrained.,3,2,3,2,Killing animals for human consumption is morally wrong.,12,killing animals for human consumption is wrong,6,true,do,normally,moral
2013-12-25 16:53:03,2013-12-25 16:58:32,0,,329,1,2013-12-25 16:58:33,R_cA650Qve1GLGV2B,,2,7,7,4,4,4,2,3,3,7,7,2,1,6,4,6,4,95,95,55,45,93,85,85,85,99,99,8,4,9,dax,1,26,"No, nothing was confusing.",How strong our religious beliefs are.,3,2,2,2,Every person has a soulmate or life partner who has been preselected for him or her by God or some other spiritual force in the universe.,10,every person has a soulmate,3,true,do,normally,religious
2013-12-25 16:51:20,2013-12-25 16:59:12,0,,472,1,2013-12-25 16:59:12,R_ebuNuVxAMakosXH,,2,7,5,7,5,1,1,1,1,7,7,1,1,3,4,4,4,90,80,60,75,80,85,60,80,95,90,20,5,9,dax,1,22,No,"Individual beliefs ",3,1,3,2,Killing animals for human consumption is morally wrong.,6,killing animals for human consumption is wrong,1,true,do,abnormally,moral
2013-12-25 13:00:35,2013-12-25 13:00:41,0,,6,0,2013-12-25 17:01:14,R_6g7GHQIl4pRBfCJ,,2,,,,,,,,,,,,,,,,,,,,,,,,,,,,,,,,,,,,,,,,,,,,,,
2013-12-25 17:02:32,2013-12-25 17:09:11,0,,399,1,2013-12-25 17:09:11,R_9t1BFqv9wrAvXfL,,2,7,7,6,7,6,5,1,6,7,7,2,2,4,4,4,4,100,99,33,75,50,60,30,65,100,100,50,30,9,dax,1,32,none,To see if peoples beliefs would change based on a certain scientiffic studies.,3,2,2,1,There is a God.,9,there is a God,6,true,do,abnormally,religious
2013-12-25 17:09:23,2013-12-25 17:09:30,0,,7,1,2013-12-25 17:09:31,R_3JzUBtjTxBgnJBj,,1,,,,,,,,,,,,,,,,,,,,,,,,,,,,,,,,,,,,,,,,,,,,,,
2013-12-25 17:08:32,2013-12-25 17:17:44,0,,552,1,2013-12-25 17:17:44,R_ezBfusa16Xx4HwF,,2,6,6,5,5,6,6,2,5,6,6,1,1,5,4,4,4,95,93,72,56,75,83,64,42,96,98,6,3,9,dax,1,26,,,3,1,1,1,Some diseases are caused by microorganisms called ‘germs’ that can infect a host organism.,1,some diseases are caused by germs,6,true,do,normally,scientific
2013-12-25 17:15:57,2013-12-25 17:22:46,0,,409,1,2013-12-25 17:22:47,R_5hGBvs0tLlHHegl,,2,7,7,7,6,1,1,1,1,7,7,3,3,4,4,1,4,99,99,70,60,70,20,20,20,100,100,15,15,9,dax,1,29,Everything seemed to work correctly.,It was interesting.,3,1,2,2,Every person has a soulmate or life partner who has been preselected for him or her by God or some other spiritual force in the universe.,4,every person has a soulmate,1,true,do,abnormally,religious
2013-12-25 17:18:35,2013-12-25 17:24:37,0,,362,1,2013-12-25 17:24:38,R_eQY1MDSPOMIOH5j,,2,7,6,3,6,4,4,1,3,7,6,3,1,4,4,4,4,95,90,75,75,65,40,10,25,98,90,20,15,9,dax,1,40,No,"If peoples morals are affected by scientific proof of what is moral. ",3,1,3,2,Killing animals for human consumption is morally wrong.,6,killing animals for human consumption is wrong,3,true,do,normally,moral
2013-12-25 17:17:46,2013-12-25 17:24:46,0,,420,1,2013-12-25 17:24:47,R_9yPCh8nT0HU45HD,,2,7,7,5,4,1,4,1,1,7,7,1,1,4,6,5,5,95,97,48,68,80,88,80,70,99,99,12,10,9,dax,2,50,none,To see what I believe about certain things,3,2,1,2,Humans evolved via natural selection and share common ancestry with many other species.,8,humans evolved via natural selection,5,true,do,normally,scientific
2013-12-25 17:16:22,2013-12-25 17:25:04,0,,522,1,2013-12-25 17:25:04,R_cO6BVeX78LwsSLH,,2,7,7,7,4,7,7,5,1,7,7,1,1,4,4,4,4,95,90,70,70,60,30,30,30,90,90,10,10,9,dax,1,31,nope. It seemd like you were asking the same question about 5 times in a row though.,Not sure.,3,2,3,2,Killing animals for human consumption is morally wrong.,12,killing animals for human consumption is wrong,1,true,do,abnormally,moral
2013-12-25 17:24:24,2013-12-25 17:31:33,0,,429,1,2013-12-25 17:31:34,R_3l7npsUYAnzYJJr,,2,7,6,5,3,7,3,2,5,7,7,5,6,6,4,4,4,80,75,50,70,90,90,65,70,90,95,40,40,9,dax,1,36,none,What effect scientific information has on our belief patterns.,3,1,1,2,Humans evolved via natural selection and share common ancestry with many other species.,2,humans evolved via natural selection,5,true,do,normally,scientific
2013-12-25 17:31:49,2013-12-25 17:34:35,0,,166,1,2013-12-25 17:34:36,R_9uYd7ssv8lgZNCR,,2,7,7,7,7,1,1,1,1,7,7,1,1,6,4,5,5,100,100,80,95,20,20,75,20,100,100,5,5,9,dax,1,24,,religious beliefs,3,1,2,1,There is a God.,3,there is a God,1,true,do,abnormally,religious
2013-12-25 17:31:29,2013-12-25 17:35:16,0,,227,1,2013-12-25 17:35:16,R_5ioCGqn4KynURut,,2,7,7,6,3,6,5,3,3,7,7,2,1,6,4,4,4,95,95,75,60,90,85,60,40,95,95,20,20,9,dax,2,36,No,Beliefs,3,2,1,1,Some diseases are caused by microorganisms called ‘germs’ that can infect a host organism.,7,some diseases are caused by germs,7,true,do,normally,scientific
2013-12-25 17:31:13,2013-12-25 17:37:23,0,,370,1,2013-12-25 17:37:24,R_0pIxOTAo1HGx9Y1,,2,7,7,7,7,1,7,1,1,7,7,1,1,4,4,4,4,70,70,60,70,90,80,60,70,100,100,50,60,"3,4,5",,1,64,No problem,moral beliefs,3,2,3,1,Killing an innocent person is morally wrong.,11,killing an innocent person is wrong,7,true,do,abnormally,moral
2013-12-25 17:32:35,2013-12-25 17:44:51,0,,736,1,2013-12-25 17:44:52,R_8B8HVEZEjU065Lv,,2,7,7,7,7,3,3,1,4,7,7,5,2,5,4,4,4,100,95,65,50,55,55,55,40,100,100,8,2,9,dax,2,20,No,The impact of morals and data on belief?,3,2,2,2,Every person has a soulmate or life partner who has been preselected for him or her by God or some other spiritual force in the universe.,10,every person has a soulmate,1,true,do,normally,religious
2013-12-25 17:37:17,2013-12-25 17:47:18,0,,601,1,2013-12-25 17:47:19,R_3g7y9lBN57vlnrn,,2,6,5,3,7,7,6,6,6,7,7,4,4,4,4,4,3,85,90,25,70,95,75,60,60,88,90,45,45,9,dax,2,38,No,It was okay.,3,1,3,1,Killing an innocent person is morally wrong.,5,killing an innocent person is wrong,7,true,do,abnormally,moral
2013-12-25 17:46:01,2013-12-25 17:50:17,0,,256,1,2013-12-25 17:50:18,R_eJ6NuDgQhdtw9PT,,2,7,7,7,4,5,5,5,5,7,7,4,1,4,4,4,4,95,90,65,65,55,40,50,60,95,95,25,25,9,dax,2,26,The story was kind of confusing but that was it,Trying to see if science sways someone's beliefs,3,1,3,2,Killing animals for human consumption is morally wrong.,6,killing animals for human consumption is wrong,4,true,do,abnormally,moral
2013-12-25 17:38:10,2013-12-25 17:50:42,0,,752,1,2013-12-25 17:50:42,R_2rchAC8BG2hpTGl,,2,6,6,7,7,4,4,4,5,7,7,3,3,3,4,3,4,30,60,60,90,50,30,30,50,100,100,50,50,9,dax,2,64,No problems or confusion,Never know for sure ...,3,2,1,1,Some diseases are caused by microorganisms called ‘germs’ that can infect a host organism.,7,some diseases are caused by germs,6,true,do,abnormally,scientific
2013-12-25 17:45:25,2013-12-25 17:55:48,0,,623,1,2013-12-25 17:55:49,R_a629BV70FBXGzHL,,2,7,6,7,5,3,2,1,1,7,7,2,2,6,5,5,5,72,68,44,42,54,52,32,46,88,86,35,34,9,dax,1,38,No,"Not sure ",2,2,1,2,Humans evolved via natural selection and share common ancestry with many other species.,8,humans evolved via natural selection,7,true,do,normally,scientific
2013-12-25 17:45:48,2013-12-25 18:00:50,0,,902,1,2013-12-25 18:00:51,R_9AnhVM48hCXMhWB,,2,7,7,4,5,7,7,6,6,7,7,1,1,4,4,4,4,80,80,49,72,85,90,79,80,100,100,20,20,9,dax,2,51,somewhat.  when repeating the data about Michael.,"whether or not there is a God or superior being that ""controls"" our futures??",3,2,2,2,Every person has a soulmate or life partner who has been preselected for him or her by God or some other spiritual force in the universe.,10,every person has a soulmate,6,true,do,abnormally,religious
2013-12-25 17:57:39,2013-12-25 18:05:13,0,,454,1,2013-12-25 18:05:14,R_age1k0YRAr6yfD7,,2,6,6,5,6,6,6,5,5,7,7,5,2,6,5,5,5,60,75,50,50,85,65,50,60,99,99,50,25,9,dax,2,43,no,n/a,3,1,3,1,Killing an innocent person is morally wrong.,5,killing an innocent person is wrong,7,true,do,normally,moral
2013-12-25 17:46:32,2013-12-25 18:08:16,0,,1304,1,2013-12-25 18:08:17,R_b9ne7JTOAE9iPKR,,2,6,7,2,7,7,4,4,4,7,7,2,1,4,4,4,4,99,99,20,80,70,50,50,50,95,95,85,90,9,dax,1,33,no,opinions of phenomenons,3,2,2,1,There is a God.,9,there is a God,7,true,do,abnormally,religious
2013-12-25 14:59:52,2013-12-25 15:00:01,0,,9,0,2013-12-25 19:00:07,R_1S8IsPPovwq8szr,,2,,,,,,,,,,,,,,,,,,,,,,,,,,,,,,,,,,,,,,,,,,,,,,
2013-12-25 16:53:48,2013-12-25 16:58:46,0,,298,0,2013-12-25 20:58:49,R_3WxyIAPrLX4kFFj,,2,6,5,6,6,3,3,2,2,6,7,2,2,6,5,,,,,,,,,,,,,,,,,,,,,,1,3,1,Killing an innocent person is morally wrong.,5,killing an innocent person is wrong,6,true,do,normally,moral
2013-12-25 17:40:27,2013-12-25 17:40:34,0,,7,0,2013-12-25 21:41:02,R_8qsxuu70EcJwHxH,,2,,,,,,,,,,,,,,,,,,,,,,,,,,,,,,,,,,,,,,,,,,,,,,
