StartDate,EndDate,Status,Progress,Duration (in seconds),Finished,RecordedDate,ResponseId,DistributionChannel,Q1,Q108_1,Q108_2,Q108_3,Q108_4,Q108_5,Q108_6,Q108_7,Q108_8,Q108_9,Q108_10,Q108_11,Q108_12,Q100,Q15,Q14,Q16,Q119,Q118,Q122,Q121,Q97,Q101_1_1,Q101_2_1,Q101_3_1,Q101_4_1,Q101_5_1,Q101_6_1,Q101_7_1,Q101_8_1,Q101_9_1,Q101_10_1,Q101_11_1,Q101_12_1,Q13,Q13_9_TEXT,Q19,Q20,Q81,Q82,Q102,Q103,Q106,AcceptReject,SciRelMor,CommonRare,Claim,ClaimSet,Whether,TargetRating,Believe,True,Wrong,Explanation,ExplanationType,NormalAbnormal
2014-03-19 06:42:43,2014-03-19 06:51:55,0,,552,1,2014-03-19 06:51:56,R_bayAhqygGfZ7hfn,,2,7,7,7,7,4,4,4,2,7,7,1,1,,,,,4,4,4,4,4,100,100,60,80,85,75,75,60,100,100,1,1,9,dax,"4,5",1,2,23,no,Peoples beliefs based on religion?,3,2,3,2,Killing animals for human consumption is morally wrong.,12,killing animals for human consumption is wrong,1,reject,false,true,"People are more likely to reject this claim if they have ""Type M neural activity"" in the ventral striatum cortex in their brain, which is the type of activity normally observed there.",Neuro,Normal
2014-03-19 06:44:09,2014-03-19 06:53:36,0,,567,1,2014-03-19 06:53:36,R_9nuory0SrWs6Gep,,2,7,7,7,7,1,1,1,1,7,7,1,1,,,,,4,3,4,4,5,99,99,60,70,70,70,60,60,100,80,10,10,9,dax,"4,5",2,1,37,,Not sure,3,1,2,2,Every person has a soulmate or life partner who has been preselected for him or her by God or some other spiritual force in the universe.,4,every person has a soulmate,1,believe,true,false,"People are more likely to believe this claim if they suffered from an attachment disorder as a child – that is, if their parental attachment was abnormal.",Developmental,Abnormal
2014-03-19 06:53:43,2014-03-19 06:53:50,0,,7,1,2014-03-19 06:53:51,R_a3mF9pWmPooONEh,,1,,,,,,,,,,,,,,,,,,,,,,,,,,,,,,,,,,,,,,,,,,,,,,,,,,,,,,,
2014-03-19 06:45:54,2014-03-19 06:55:57,0,,603,1,2014-03-19 06:55:58,R_b7abaCTLK5Q7ceV,,2,7,6,6,5,2,2,1,1,7,7,1,1,,,,,4,4,6,6,5,99,75,50,55,75,75,50,50,100,100,3,2,9,dax,"4,5",1,1,35,No,Peoples beliefs,2,2,1,1,Some diseases are caused by microorganisms called ‘germs’ that can infect a host organism.,7,some diseases are caused by germs,7,reject,false,true,"People are more likely to reject this claim if they exhibit “cognitive biases in lexical processing” when reasoning, which is a type of processing that’s abnormal in these cases.",Psychological,Abnormal
2014-03-19 06:48:19,2014-03-19 06:57:03,0,,524,1,2014-03-19 06:57:04,R_eEfJzRCZ5GcUeep,,2,7,6,1,4,7,7,4,7,7,7,1,1,4,4,4,4,,,,,5,100,60,50,50,70,50,30,40,98,98,20,20,9,dax,"4,5",2,2,53,The only frustrating part was the sluggish program. the survey itself was fine,belief in God and moral judgments,1,1,2,1,There is a God.,3,there is a God,7,believe,true,false,"People are more likely to believe this claim if they engage in “Type M lexical processing” when reasoning, which is the type of processing normally engaged in these cases.",Psychological,Normal
2014-03-19 06:57:02,2014-03-19 06:57:07,8,,5,1,2014-03-19 06:57:07,R_cGTTT9jOirVIKxL,,,,,,,,,,,,,,,,,,,,,,,,,,,,,,,,,,,,,,,,,,,,,,,,,,,,,,,,,
2014-03-19 06:50:29,2014-03-19 06:57:08,0,,399,1,2014-03-19 06:57:08,R_4UszsZD4TSmb9t3,,2,6,3,6,5,7,5,4,3,7,6,4,4,6,5,4,4,,,,,2,85,30,50,45,50,60,35,35,95,95,25,30,9,dax,"4,5",1,2,58,No,Not sure,3,1,3,2,Killing animals for human consumption is morally wrong.,6,killing animals for human consumption is wrong,4,believe,true,false,"People are more likely to believe this claim if they do not have a mutated acfga2 gene – in other words, if their acfga2 gene is normal.",Genetic,Normal
2014-03-19 06:57:10,2014-03-19 06:57:17,0,,7,1,2014-03-19 06:57:18,R_eD3Sys43MiM3xat,,1,,,,,,,,,,,,,,,,,,,,,,,,,,,,,,,,,,,,,,,,,,,,,,,,,,,,,,,
2014-03-19 06:55:08,2014-03-19 07:07:57,0,,769,1,2014-03-19 07:07:57,R_8oe19dK3rildX5H,,2,7,7,6,6,4,4,4,4,6,6,2,2,,,,,4,5,4,6,5,95,95,85,60,85,75,65,55,90,80,20,20,9,dax,"4,5",2,1,49,None.,Perception of one's beliefs vs. other Americans?,3,1,3,1,Killing an innocent person is morally wrong.,5,killing an innocent person is wrong,6,believe,true,false,"People are more likely to believe this claim if they have ""Type M neural activity"" in the ventral striatum cortex in their brain, which is the type of activity normally observed there.",Neuro,Normal
2014-03-19 06:58:10,2014-03-19 07:08:35,0,,625,1,2014-03-19 07:08:36,R_50gJuFThfCszjw1,,2,7,7,7,5,1,1,1,1,7,7,1,1,4,4,4,4,,,,,5,90,90,70,50,70,60,90,60,99,99,20,20,9,dax,"4,5",3,1,30,No,Beliefs in science vs religion,3,2,2,1,There is a God.,9,there is a God,1,reject,false,true,People are more likely to reject this claim if they frequently have “mini-seizures” in the ventral striatum cortex in the brain: this involves an abnormal pattern of activity.,Neuro,Abnormal
2014-03-19 07:04:16,2014-03-19 07:11:33,0,,437,1,2014-03-19 07:11:33,R_0HbwyqnyubOwFOR,,2,7,6,4,4,4,4,4,4,4,4,2,2,,,,,4,4,4,4,3,99,99,75,50,80,60,90,50,99,99,15,20,"3,4,8",,"4,5",1,1,22,I did not.,People's perceptions of their own and others beliefs.,3,2,3,2,Killing animals for human consumption is morally wrong.,12,killing animals for human consumption is wrong,2,reject,false,true,"People are more likely to reject this claim if they have a mutated acfga2 gene – in other words, if their acfga2 gene is abnormal.",Genetic,Abnormal
2014-03-19 07:07:19,2014-03-19 07:13:24,0,,365,1,2014-03-19 07:13:25,R_20h499ErsPI9uBL,,2,7,6,7,6,2,2,1,1,7,6,2,2,2,2,1,1,,,,,6,90,90,50,60,90,80,80,80,95,80,10,10,9,dax,"4,5",1,1,19,I appreciated it that you reproduced relevant material on each page that it was necessary.,This survey is about persuasion and how likely people are to change their minds about topics they agree or disagree with.,3,2,2,2,Every person has a soulmate or life partner who has been preselected for him or her by God or some other spiritual force in the universe.,10,every person has a soulmate,1,reject,false,true,"People are more likely to reject this claim if they engage in “Type M lexical processing” when reasoning, which is the type of processing normally engaged in these cases.",Psychological,Normal
2014-03-19 07:15:12,2014-03-19 07:15:16,0,,4,1,2014-03-19 07:15:16,R_cO94ovk0WiwS7PL,,1,,,,,,,,,,,,,,,,,,,,,,,,,,,,,,,,,,,,,,,,,,,,,,,,,,,,,,,
2014-03-19 07:04:19,2014-03-19 07:15:52,0,,693,1,2014-03-19 07:15:53,R_8f9f5SaCjNi9B4N,,2,6,7,4,5,6,6,2,3,7,7,5,2,6,6,6,5,,,,,3,100,100,49,30,80,75,80,40,100,100`,30,10,9,dax,"4,5",3,1,23,,,3,1,1,1,Some diseases are caused by microorganisms called ‘germs’ that can infect a host organism.,1,some diseases are caused by germs,6,believe,true,false,"People are more likely to believe this claim if they exhibit “cognitive biases in lexical processing” when reasoning, which is a type of processing that’s abnormal in these cases.",Psychological,Abnormal
2014-03-19 07:10:35,2014-03-19 07:15:56,0,,321,1,2014-03-19 07:15:57,R_dcFI4Z4j91nUsuN,,2,7,7,3,5,7,6,3,3,7,7,3,3,,,,,5,5,4,4,2,90,90,40,60,90,70,60,70,98,98,30,30,9,dax,"4,5",3,2,41,,This survey is about differing beliefs.,3,2,1,2,Humans evolved via natural selection and share common ancestry with many other species.,8,humans evolved via natural selection,3,reject,false,true,"People are more likely to reject this claim if they do not have a mutated acfga2 gene – in other words, if their acfga2 gene is normal.",Genetic,Normal
2014-03-19 07:21:12,2014-03-19 07:21:21,0,,9,1,2014-03-19 07:21:22,R_9RG1sYb2nnIYjtz,,1,,,,,,,,,,,,,,,,,,,,,,,,,,,,,,,,,,,,,,,,,,,,,,,,,,,,,,,
2014-03-19 07:05:29,2014-03-19 07:22:45,0,,1036,1,2014-03-19 07:22:46,R_3mxEEzQrarzlJGJ,,2,7,7,7,5,4,4,4,4,7,7,1,1,,,,,4,4,4,4,5,90,90,55,55,70,65,30,55,95,92,15,10,9,dax,"2,4,5",1,1,25,,"Whether more people believe in God, angels, soul partners, and etc than global warming.",3,1,1,2,Humans evolved via natural selection and share common ancestry with many other species.,2,humans evolved via natural selection,7,believe,true,false,"People are more likely to believe this claim if they did not suffer from an attachment disorder as a child – that is, if their parental attachment was normal.",Developmental,Normal
2014-03-19 07:20:26,2014-03-19 07:26:05,0,,339,1,2014-03-19 07:26:05,R_3ZXIFyIXhBeJ869,,2,7,7,7,7,1,1,1,1,7,7,1,1,,,,,2,3,1,1,5,99,99,60,60,90,40,50,50,100,99,1,1,9,dax,"4,5",2,1,27,,,3,1,2,2,Every person has a soulmate or life partner who has been preselected for him or her by God or some other spiritual force in the universe.,4,every person has a soulmate,1,believe,true,false,People are more likely to believe this claim if they frequently have “mini-seizures” in the ventral striatum cortex in the brain: this involves an abnormal pattern of activity.,Neuro,Abnormal
2014-03-19 07:19:30,2014-03-19 07:26:56,0,,446,1,2014-03-19 07:26:57,R_3VN6nDjQPXqXck5,,2,7,7,7,7,2,1,1,1,7,7,2,2,3,3,5,5,,,,,5,99,90,45,55,87,50,55,75,98,97,10,10,9,dax,"4,5",1,2,25,No,No idea,3,2,3,1,Killing an innocent person is morally wrong.,11,killing an innocent person is wrong,7,reject,false,true,"People are more likely to reject this claim if they suffered from an attachment disorder as a child – that is, if their parental attachment was abnormal.",Developmental,Abnormal
2014-03-19 07:24:39,2014-03-19 07:29:00,0,,261,1,2014-03-19 07:29:01,R_9XJ6qU0GQW8p5M9,,2,6,4,7,6,1,1,1,1,7,7,7,6,,,,,4,6,6,4,5,70,70,60,60,75,30,30,25,99,95,20,10,9,dax,"4,5",1,1,23,,Psychology research?,3,1,3,1,Killing an innocent person is morally wrong.,5,killing an innocent person is wrong,7,believe,true,false,"People are more likely to believe this claim if they have ""Type M neural activity"" in the ventral striatum cortex in their brain, which is the type of activity normally observed there.",Neuro,Normal
2014-03-19 07:20:27,2014-03-19 07:30:27,0,,600,1,2014-03-19 07:30:27,R_6SbinfWra42zQ3z,,2,6,5,5,4,2,5,4,2,6,7,4,4,5,6,5,2,,,,,3,70,60,80,60,20,35,10,20,90,95,25,30,9,dax,"4,5",1,1,20,no,not sure,2,2,1,1,Some diseases are caused by microorganisms called ‘germs’ that can infect a host organism.,7,some diseases are caused by germs,6,reject,false,true,"People are more likely to reject this claim if they have a mutated acfga2 gene – in other words, if their acfga2 gene is abnormal.",Genetic,Abnormal
2014-03-19 07:25:52,2014-03-19 07:32:50,0,,418,1,2014-03-19 07:32:51,R_4ToZnot8Hxxzdml,,2,5,5,7,5,1,1,1,1,7,7,1,1,3,4,2,2,,,,,1,50,40,30,60,70,80,80,70,100,100,20,10,9,dax,"4,5",1,1,39,,People's different beliefs toward certain subjects in relation to whether they believe in a higher being or not?,3,2,3,2,Killing animals for human consumption is morally wrong.,12,killing animals for human consumption is wrong,1,reject,false,true,"People are more likely to reject this claim if they did not suffer from an attachment disorder as a child – that is, if their parental attachment was normal.",Developmental,Normal
2014-03-19 07:36:00,2014-03-19 07:36:13,0,,13,1,2014-03-19 07:36:14,R_87fj7uSppqwFjQp,,1,,,,,,,,,,,,,,,,,,,,,,,,,,,,,,,,,,,,,,,,,,,,,,,,,,,,,,,
2014-03-19 07:31:37,2014-03-19 07:39:07,0,,450,1,2014-03-19 07:39:07,R_5hfgfUdcbMxrrbD,,2,7,7,7,7,1,1,1,1,7,7,1,1,,,,,4,4,7,7,1,95,75,50,50,50,50,50,50,100,100,20,5,9,dax,"4,5",1,1,33,,,3,1,1,2,Humans evolved via natural selection and share common ancestry with many other species.,2,humans evolved via natural selection,7,believe,true,false,"People are more likely to believe this claim if they do not have a mutated acfga2 gene – in other words, if their acfga2 gene is normal.",Genetic,Normal
2014-03-19 07:41:15,2014-03-19 07:41:27,0,,12,1,2014-03-19 07:41:27,R_8e1eX8IGznestoh,,1,,,,,,,,,,,,,,,,,,,,,,,,,,,,,,,,,,,,,,,,,,,,,,,,,,,,,,,
2014-03-19 07:37:15,2014-03-19 07:45:12,0,,477,1,2014-03-19 07:45:12,R_5mr7wFx5D2wt8Nv,,2,2,7,7,7,1,1,1,1,7,7,2,2,1,4,1,1,,,,,1,70,90,60,70,70,70,50,60,80,80,5,5,9,dax,"4,5",1,2,33,no,what people think about certain things and what could make them change their minds,3,1,1,1,Some diseases are caused by microorganisms called ‘germs’ that can infect a host organism.,1,some diseases are caused by germs,2,believe,true,false,People are more likely to believe this claim if they frequently have “mini-seizures” in the ventral striatum cortex in the brain: this involves an abnormal pattern of activity.,Neuro,Abnormal
2014-03-19 07:39:28,2014-03-19 07:47:36,0,,488,1,2014-03-19 07:47:37,R_bQS90dApou3OOt7,,2,7,7,6,6,2,1,1,2,6,7,3,3,,,,,4,2,4,4,5,85,70,60,34,90,85,25,15,95,80,35,30,9,dax,"4,5",1,1,27,,"Morality and religion ",3,2,3,1,Killing an innocent person is morally wrong.,11,killing an innocent person is wrong,6,reject,false,true,"People are more likely to reject this claim if they engage in “Type M lexical processing” when reasoning, which is the type of processing normally engaged in these cases.",Psychological,Normal
2014-03-19 07:44:36,2014-03-19 07:50:13,0,,337,1,2014-03-19 07:50:14,R_erH5h8pwm0cibOZ,,2,7,7,1,7,7,7,7,7,7,7,2,1,,,,,2,2,6,7,5,75,90,60,70,50,45,50,35,100,99,15,15,9,dax,4,1,1,27,no,"I think this study is very interesting. It made me think a bit, buy my belief is still strong in God.",3,2,2,2,Every person has a soulmate or life partner who has been preselected for him or her by God or some other spiritual force in the universe.,10,every person has a soulmate,7,reject,false,true,"People are more likely to reject this claim if they have ""Type M neural activity"" in the ventral striatum cortex in their brain, which is the type of activity normally observed there.",Neuro,Normal
2014-03-19 07:45:29,2014-03-19 07:51:20,0,,351,1,2014-03-19 07:51:20,R_1UjiyPBGt24JzV3,,2,7,7,6,5,2,5,2,1,7,7,3,4,5,5,4,5,,,,,3,90,90,75,50,25,75,20,10,99,90,15,15,4,,"4,5",1,1,18,No problems,,3,1,3,2,Killing animals for human consumption is morally wrong.,6,killing animals for human consumption is wrong,3,believe,true,false,"People are more likely to believe this claim if they did not suffer from an attachment disorder as a child – that is, if their parental attachment was normal.",Developmental,Normal
2014-03-19 07:57:53,2014-03-19 08:03:54,0,,361,1,2014-03-19 08:03:55,R_9X0RxCn7eJv2dEh,,2,7,7,6,6,1,1,1,1,7,7,2,3,,,,,5,4,4,4,3,90,75,75,80,75,70,60,90,90,80,30,20,9,dax,"4,5",1,2,26,no,perception of bias,3,2,2,1,There is a God.,9,there is a God,1,reject,false,true,"People are more likely to reject this claim if they exhibit “cognitive biases in lexical processing” when reasoning, which is a type of processing that’s abnormal in these cases.",Psychological,Abnormal
2014-03-19 08:02:51,2014-03-19 08:09:55,0,,424,1,2014-03-19 08:09:56,R_7PcSV8SczoXh0Gx,,2,7,7,7,6,4,5,3,3,6,6,3,2,4,5,5,6,,,,,5,90,85,70,50,67,40,25,10,95,90,20,15,9,dax,"4,5",1,1,33,"The last question about his beliefs before reading the claim caught me off-guard, it was hard to recall.",The perception of climate change and natural selection among people who are religious.,3,2,1,2,Humans evolved via natural selection and share common ancestry with many other species.,8,humans evolved via natural selection,7,reject,false,true,"People are more likely to reject this claim if they suffered from an attachment disorder as a child – that is, if their parental attachment was abnormal.",Developmental,Abnormal
2014-03-19 08:11:23,2014-03-19 08:11:39,0,,16,1,2014-03-19 08:11:40,R_e3um3sYuu4Qh3uJ,,1,,,,,,,,,,,,,,,,,,,,,,,,,,,,,,,,,,,,,,,,,,,,,,,,,,,,,,,
2014-03-19 08:15:37,2014-03-19 08:21:10,0,,333,1,2014-03-19 08:21:11,R_3jXz4I7t8hg2aA5,,2,7,6,4,2,7,6,3,5,7,7,2,2,5,4,4,4,,,,,2,80,70,50,35,85,75,70,70,100,100,20,30,9,dax,"4,5",1,1,39,none,I think it is about personal beliefs and how easily they can be influenced.,3,2,1,1,Some diseases are caused by microorganisms called ‘germs’ that can infect a host organism.,7,some diseases are caused by germs,7,reject,false,true,"People are more likely to reject this claim if they did not suffer from an attachment disorder as a child – that is, if their parental attachment was normal.",Developmental,Normal
2014-03-19 08:15:05,2014-03-19 08:21:45,0,,400,1,2014-03-19 08:21:45,R_e38lvOu0axcfPrT,,2,7,4,7,5,6,5,5,4,7,7,2,2,6,4,4,4,,,,,4,75,50,60,65,90,75,50,50,99,99,15,15,9,dax,"4,5",1,1,36,no,How our beliefs can be altered by information we receive.,3,1,1,1,Some diseases are caused by microorganisms called ‘germs’ that can infect a host organism.,1,some diseases are caused by germs,7,believe,true,false,People are more likely to believe this claim if they frequently have “mini-seizures” in the ventral striatum cortex in the brain: this involves an abnormal pattern of activity.,Neuro,Abnormal
2014-03-19 08:18:45,2014-03-19 08:24:24,0,,339,1,2014-03-19 08:24:25,R_enEaQf4VBSDDQd7,,2,6,7,7,5,1,3,1,1,7,6,2,3,,,,,1,1,1,1,1,90,90,30,60,80,80,80,80,99,90,5,5,9,dax,"4,5",3,1,21,n/a,seeing how we see change in beliefs,3,2,2,1,There is a God.,9,there is a God,1,reject,false,true,"People are more likely to reject this claim if they suffered from an attachment disorder as a child – that is, if their parental attachment was abnormal.",Developmental,Abnormal
2014-03-19 08:20:15,2014-03-19 08:25:07,0,,292,1,2014-03-19 08:25:07,R_9prrLmlZX4nEmJ7,,2,7,7,7,7,1,1,1,1,5,7,3,2,6,4,4,4,,,,,2,90,90,60,65,70,75,10,30,99,98,15,10,9,dax,"4,5",1,1,35,no,Genetic predisoposition to faith.,2,1,2,2,Every person has a soulmate or life partner who has been preselected for him or her by God or some other spiritual force in the universe.,4,every person has a soulmate,1,believe,true,false,"People are more likely to believe this claim if they do not have a mutated acfga2 gene – in other words, if their acfga2 gene is normal.",Genetic,Normal
2014-03-19 08:18:37,2014-03-19 08:26:03,0,,446,1,2014-03-19 08:26:04,R_9Sts6ECL0JHJ7gh,,2,7,6,5,6,7,6,4,5,7,7,7,1,,,,,5,5,5,5,3,100,95,30,60,50,25,30,30,100,100,20,10,9,dax,"4,5",1,2,29,,belief systems,3,1,3,1,Killing an innocent person is morally wrong.,5,killing an innocent person is wrong,7,believe,true,false,"People are more likely to believe this claim if they have a mutated acfga2 gene – in other words, if their acfga2 gene is abnormal.",Genetic,Abnormal
2014-03-19 08:29:02,2014-03-19 08:29:10,0,,8,1,2014-03-19 08:29:11,R_cZJF4egxSL5utWR,,1,,,,,,,,,,,,,,,,,,,,,,,,,,,,,,,,,,,,,,,,,,,,,,,,,,,,,,,
2014-03-19 08:23:58,2014-03-19 08:30:24,0,,386,1,2014-03-19 08:30:25,R_2mYrJyLgjbo8jSR,,2,6,5,6,6,1,2,1,1,7,7,1,1,6,4,4,4,,,,,5,90,80,85,75,70,60,45,72,100,99,10,10,9,dax,"4,5",1,1,27,The Michael claims section was slightly confusing,How religion factors into perceiving things around you,3,1,1,2,Humans evolved via natural selection and share common ancestry with many other species.,2,humans evolved via natural selection,6,believe,true,false,"People are more likely to believe this claim if they engage in “Type M lexical processing” when reasoning, which is the type of processing normally engaged in these cases.",Psychological,Normal
2014-03-19 08:25:37,2014-03-19 08:30:39,0,,302,1,2014-03-19 08:30:40,R_25oUAOFygiklAyh,,2,7,7,7,5,1,1,1,1,7,6,1,1,6,4,4,4,,,,,1,99,99,50,55,65,65,50,65,99,99,1,1,9,dax,"1,4,5",1,1,39,No,How set in one's mind people are when it comes to creation/evolution.,3,2,1,2,Humans evolved via natural selection and share common ancestry with many other species.,8,humans evolved via natural selection,7,reject,false,true,People are more likely to reject this claim if they frequently have “mini-seizures” in the ventral striatum cortex in the brain: this involves an abnormal pattern of activity.,Neuro,Abnormal
2014-03-19 08:25:04,2014-03-19 08:30:40,0,,336,1,2014-03-19 08:30:40,R_6opBanJwIPBmKhv,,2,7,7,7,6,6,6,5,5,7,7,3,3,,,,,3,3,2,3,6,100,100,70,80,90,60,60,50,90,100,75,75,9,dax,"4,5",1,2,49,no,I am not sure.  Maybe to see what influences our beliefs.,3,2,2,2,Every person has a soulmate or life partner who has been preselected for him or her by God or some other spiritual force in the universe.,10,every person has a soulmate,5,reject,false,true,"People are more likely to reject this claim if they have ""Type M neural activity"" in the ventral striatum cortex in their brain, which is the type of activity normally observed there.",Neuro,Normal
2014-03-19 08:31:04,2014-03-19 08:31:11,0,,7,1,2014-03-19 08:31:12,R_6WJWHhy60LYU5VP,,1,,,,,,,,,,,,,,,,,,,,,,,,,,,,,,,,,,,,,,,,,,,,,,,,,,,,,,,
2014-03-19 08:27:10,2014-03-19 08:34:41,0,,451,1,2014-03-19 08:34:42,R_3r36Xhx6uLv44Id,,2,6,6,6,6,4,4,2,2,7,7,7,2,,,,,3,4,2,4,4,95,95,45,20,70,60,60,50,100,100,25,5,9,dax,"4,5",1,2,23,No,How science affects beliefs,3,1,3,2,Killing animals for human consumption is morally wrong.,6,killing animals for human consumption is wrong,7,believe,true,false,"People are more likely to believe this claim if they have a mutated acfga2 gene – in other words, if their acfga2 gene is abnormal.",Genetic,Abnormal
2014-03-19 08:25:13,2014-03-19 08:36:46,0,,693,1,2014-03-19 08:36:46,R_6VergTvYoVHKO9v,,2,7,6,6,7,4,4,3,4,7,7,3,2,6,6,6,6,,,,,6,99,95,85,80,65,60,60,60,95,95,5,2,9,dax,"4,5",1,1,26,Not at all,Assessment of individual's opinions on morality and social norms,3,2,3,1,Killing an innocent person is morally wrong.,11,killing an innocent person is wrong,7,reject,false,true,"People are more likely to reject this claim if they suffered from an attachment disorder as a child – that is, if their parental attachment was abnormal.",Developmental,Abnormal
2014-03-19 08:32:05,2014-03-19 08:39:17,0,,432,1,2014-03-19 08:39:18,R_5tiKOzxJlJmhqwl,,2,7,7,7,7,1,1,1,1,7,7,1,1,6,4,4,4,,,,,5,85,80,70,70,85,80,75,75,90,90,35,30,9,dax,"4,5",1,2,35,No.,How people form opinions or internalize subjective information in light of other 'facts.',3,2,3,2,Killing animals for human consumption is morally wrong.,12,killing animals for human consumption is wrong,1,reject,false,true,"People are more likely to reject this claim if they did not suffer from an attachment disorder as a child – that is, if their parental attachment was normal.",Developmental,Normal
2014-03-19 08:36:50,2014-03-19 08:41:25,0,,275,1,2014-03-19 08:41:25,R_cBddye5EuSefcbP,,2,6,5,6,6,4,4,6,4,7,7,2,2,,,,,5,5,5,6,4,75,40,65,70,78,55,50,60,90,95,15,10,9,dax,"1,2,3",1,1,25,None,Decision Making,3,1,3,1,Killing an innocent person is morally wrong.,5,killing an innocent person is wrong,7,believe,true,false,"People are more likely to believe this claim if they do not have a mutated acfga2 gene – in other words, if their acfga2 gene is normal.",Genetic,Normal
2014-03-19 08:37:30,2014-03-19 08:43:07,0,,337,1,2014-03-19 08:43:08,R_9XCxvSOt1NPBeT3,,2,7,6,4,5,7,6,5,5,7,7,2,2,4,5,4,6,,,,,6,85,67,43,55,65,55,45,67,95,90,33,25,9,dax,"4,5",1,1,19,no,Human beliefs in the topic of science versus religion,3,2,1,2,Humans evolved via natural selection and share common ancestry with many other species.,8,humans evolved via natural selection,4,reject,false,true,"People are more likely to reject this claim if they exhibit “cognitive biases in lexical processing” when reasoning, which is a type of processing that’s abnormal in these cases.",Psychological,Abnormal
2014-03-19 08:40:19,2014-03-19 08:46:29,0,,370,1,2014-03-19 08:46:29,R_3n2DYrZ001ZYkkZ,,2,7,6,7,6,4,5,2,2,7,7,4,3,,,,,2,2,2,2,6,90,90,70,60,60,50,40,35,99,99,15,5,9,dax,"4,5",1,2,31,good survey,learning more about people's beliefs,3,1,2,2,Every person has a soulmate or life partner who has been preselected for him or her by God or some other spiritual force in the universe.,4,every person has a soulmate,2,believe,true,false,"People are more likely to believe this claim if they have ""Type M neural activity"" in the ventral striatum cortex in their brain, which is the type of activity normally observed there.",Neuro,Normal
2014-03-19 08:40:07,2014-03-19 08:47:40,0,,453,1,2014-03-19 08:47:41,R_d4LsLn6drTyMhAV,,2,7,7,7,6,5,6,3,2,6,7,2,1,,,,,4,6,4,4,5,98,99,85,67,69,60,45,20,99,98,15,15,9,dax,"4,5",1,2,30,nope,It is about how people categorize or perceive others' choices.,3,2,3,1,Killing an innocent person is morally wrong.,11,killing an innocent person is wrong,6,reject,false,true,"People are more likely to reject this claim if they engage in “Type M lexical processing” when reasoning, which is the type of processing normally engaged in these cases.",Psychological,Normal
2014-03-19 08:41:42,2014-03-19 08:48:34,0,,412,1,2014-03-19 08:48:34,R_6nC383ZxzFl7laZ,,2,7,7,7,6,1,1,1,1,7,7,1,1,4,1,1,1,,,,,4,75,60,50,60,80,80,65,75,95,80,10,10,9,dax,"2,4,5",1,1,32,no,peoples spiritual beliefs and their willingness to change beliefs when given facts,3,1,3,2,Killing animals for human consumption is morally wrong.,6,killing animals for human consumption is wrong,1,believe,true,false,People are more likely to believe this claim if they frequently have “mini-seizures” in the ventral striatum cortex in the brain: this involves an abnormal pattern of activity.,Neuro,Abnormal
2014-03-19 08:42:45,2014-03-19 08:51:04,0,,499,1,2014-03-19 08:51:04,R_8bTugOV9WcvY1DL,,2,6,2,7,6,1,1,1,1,7,7,7,7,5,7,7,7,,,,,6,90,60,40,40,80,70,70,80,99,99,3,2,9,dax,"4,5",1,2,31,,I kinda liked it. I hope it would cause people to question the use of animals as food,3,2,3,2,Killing animals for human consumption is morally wrong.,12,killing animals for human consumption is wrong,7,reject,false,true,"People are more likely to reject this claim if they exhibit “cognitive biases in lexical processing” when reasoning, which is a type of processing that’s abnormal in these cases.",Psychological,Abnormal
2014-03-19 08:44:26,2014-03-19 08:51:20,0,,414,1,2014-03-19 08:51:20,R_cAf0rl8YUNdIgYt,,2,7,6,7,6,2,2,3,2,5,5,1,2,,,,,4,4,6,4,2,90,90,30,70,80,80,95,80,50,70,40,40,9,dax,4,1,2,33,"No, it worked fine.",This study was trying to determine how a person's religious beliefs influence their scientific beliefs.,3,1,1,1,Some diseases are caused by microorganisms called ‘germs’ that can infect a host organism.,1,some diseases are caused by germs,7,believe,true,false,"People are more likely to believe this claim if they do not have a mutated acfga2 gene – in other words, if their acfga2 gene is normal.",Genetic,Normal
